[Phase de scratch] *BREAK* Silence brisé par les sirènes de la police *BREAK*  *BREAK* [Refrain] *BREAK* Le globe c'est Amistad *BREAK* Leur paradis est fiscal *BREAK* C'est leur modèle de profit sauvage qui terrorise *BREAK* Mais que fait la police *BREAK* Les gens sont hors de leurs plans *BREAK* Si peu nombreux dans leur camps *BREAK* Leur système est rodé pour que les âmes se détruisent *BREAK* Mais que fait la police *BREAK*  *BREAK* [Couplet 1 - Akhenaton] *BREAK*  *BREAK* Que fait la police *BREAK* Les voyous braquent des banques font peter les coffres et fiche tout dans leur planque *BREAK* Ca arrive près d'chez vous le quartier interdit aux flics où vivent tout ces bandits c'est la bourse *BREAK* Ils vont pas en prison en tout cas pas les gros *BREAK* Un salopard ici c'est juste un mec qui a les crocs *BREAK* Code pénal pas celui de la multitude *BREAK* Quand ils passent à la barre hop la justice mute *BREAK* Que fait la police *BREAK* Elle devrait chuter leur fric au lieu de buter les noirs a Minneapolis *BREAK* Allo le 17 j'sais pas qui tire les ficelles *BREAK* J'ai vu des terroristes poser des bombes à misère *BREAK* Puis des labos se placer dans le line-up *BREAK* A coté de ceux qui nous font grailler du round-up *BREAK* Qui s'plaignent il y a trop de lascars *BREAK* Et qui deposent des brevets sur les plantes à Madagascar *BREAK* C'est pas du vol c'est de la science *BREAK* C'est le plus fort qui l'emporte et ouais voici la France *BREAK* La maison où le supo penètre sans effort quand on l'endort *BREAK* Avec un concombre, un porc et un canard mort *BREAK* Niveau con ça file droit vers la pandémie *BREAK* C'est pas la marée chaussée qui stop'ra l'épidémie *BREAK* Car tous veulent un régime de ministre *BREAK* Trois jobs légaux interdit a ceux qu'on administre *BREAK*  *BREAK* [Refrain] *BREAK*  *BREAK* [Couplet 2 - Shurik'n] *BREAK* Les mecs me font marrer, on dit que c'est la crise *BREAK* Pourtant ça empire ils comprennent pas que trop de gens soient paumés *BREAK* Trop sonnés pour résonner, sur-tendus, affamés *BREAK* Facile à duper, regarde-les nous manipuler *BREAK* Magouilles au labo, et qui c'est les cobayes? *BREAK* On avale des cachets comme les dragées au mariage *BREAK* Ils parient sur les chances, spéculent sur nos santés *BREAK* Dieu fasse qu'il n'y ait plus de malade c'est sur ils vont déchanter *BREAK* Désenchantés, on vit sur leur terrain de jeu *BREAK* Les règles sont simples on place l'humain après l'enjeu *BREAK* Et ça te parle de peuple, mais seul le pouvoir les anime *BREAK* Ils peuvent fermer une usine sans se soucier des victimes *BREAK* Que fait la police? *BREAK* Elle tourne des documentaires *BREAK* Et calme à grand coup de lacrymo le moindre contestataire *BREAK* Pendant que la plupart d'entre nous postule pour des jours meilleurs *BREAK* Regarde moi tout c'monde qui attend pour un CDI aux Restos du Cœur *BREAK* Il ne reste que les pleures, et l'huissier sonne à l'heure *BREAK* Où aux infos où tous annoncent une hausse des valeurs *BREAK* Pressant le citron comme la dîme jadis, étrangler la masse *BREAK* Combien des nôtres iront décorer leur tableaux de chasse *BREAK* J'ai pas vu d'barques à Saint-Tropez, non! *BREAK* Apparemment les temps sont durs ça dépend surtout du côté où tu nais *BREAK* Bureaux au sommet des buildings, attaché-case et comptes suisses *BREAK* Y'a qu'une seule justice: celle du bénéfice *BREAK*  *BREAK* [Refrain] *BREAK*  *BREAK* [Phase de scratch] *BREAK* Silence brisé par les sirènes de la police
 *BREAK* Je vais vous raconter cette soirée mémorable *BREAK* Où le groupe IAM a été déclaré comme insortable *BREAK* On était tous les 6, cool, au Vieux Port *BREAK* Quand Imhotep a dit *BREAK* Ah ouais d'accord répondit l'Overlord *BREAK* Je la sens hardcore alimentée à la Pelforth *BREAK* Pleine de petits bourges au portefeuille épais *BREAK* Qui passent dans la rue et ne pensent qu'à nous mépriser *BREAK*  *BREAK* [Couplet 2 : Shurik'n] *BREAK* Juste mais tant pis aucun de nous n'hésite, je m'explique *BREAK* Un quart d'heure de plus on passait à l'état de stalagmite *BREAK* Il y avait le blizzard, le celsius était en baisse *BREAK* Comme une belle nuit d'hiver à Mourmansk en URSS *BREAK* Hors de question que l'on passe la nuit ici *BREAK* Certains n'étaient pas d'accord, enfin bref nous voilà partis *BREAK* Métro à l'oeil, merci la RTM *BREAK* Nous penserons à vous quand viendra le moment des étrennes *BREAK*  *BREAK* [Couplet 3 : Akhenaton] *BREAK* Après un mot pour la régie qui nous sponsorise *BREAK* Il ne faut pas que je m'éternise, OK *BREAK* Revenons dans le sujet station de métro Perrier *BREAK* C'est là que Du Guesclin organisait ses soirées *BREAK* Devant la maison, il y avait des milliers de lampadaires *BREAK* On se serait cru le 14 au spectacle Sons et Lumières *BREAK* Arrivés à l'entrée, le mec nous dit c'est 70 *BREAK* Dis moi, t'es pas un peu le fils à gratis? *BREAK*  *BREAK* [Couplet 4 : Shurik'n] *BREAK* Bon allez, dégage, allez gicle, vire de là *BREAK* Indique moi plutôt le chemin droit vers le buffet froid *BREAK* 1 - l'entrée bien entendu je ne la paye pas *BREAK* 2 - On va tout bouffer et ce sera tout pour toi *BREAK* Attentat violent au boulevard Michelet *BREAK* Les sandwiches ont voltigé, aucun rescapé *BREAK* Car pour le cas où vous ne vous en apercevez pas *BREAK* Nous sommes "Ponction directe" et c'est un attentat *BREAK*  *BREAK* [Couplet 5 : Akhenaton] *BREAK* Au bout de 5 minutes, la piaule était Sodome et Gomorrhe *BREAK* Certains disaient être envahis par la zone des quartiers nord *BREAK* Ou avec des regains de Jean Marie si rituels *BREAK* "Oh là là, ces immigrés sont vraiment trop cruels *BREAK* C'est de la provocation" Allez ferme ta bouche *BREAK* Et passe moi donc une femme qui ne veut pas qu'on la touche *BREAK* Il m'a gavé mais j'ai bougé car j'avais faim *BREAK* Qui vois-je au buffet? S.H.U.R.I.K.E.N *BREAK*  *BREAK* [Couplet 6 : Shurik'n] *BREAK* Euh! Je me tate entre le paté et le jambon *BREAK* Pendant que dans la salle les autres font évidemment les cons *BREAK* Visant à s'intégrer en communiquant *BREAK* Mais la communication se fait à coups de taquets dans les dents *BREAK* C'est trop beau mais moi j'ai chaud *BREAK* J'ai bu et pas que du sirop *BREAK* Alors dans la salle je sens monter un odeur de pavot *BREAK* C'était derrière moi, deux fils à papa se dévergondaient *BREAK* Et devinez qui l'on va s'empresser d'accuser? *BREAK*  *BREAK* [Couplet 7 : Akhenaton] *BREAK* Je n'avais plus rien à dire, j'étais fin prêt à sortir *BREAK* Quand une fille daigna me faire le premier sourire *BREAK* Excitée apparemment, car on est assez différents *BREAK* Ca fait bien de coucher avec un mec au regard menaçant *BREAK* On est allé dehors, assis loin des amis *BREAK* Elle avait une jupe, tombe-là et fais pas de chichi *BREAK* Fais ce que je dis, car il fallait être plus sure *BREAK* Ou je t'écrase un pan bagna bien gras dans la figure *BREAK* C'est un attentat *BREAK*  *BREAK* [Couplet 8: Shurik'n] *BREAK* Retour à l'intérieur, j'ai fini de digérer ma bière *BREAK* Pour mon plus grand malheur toujours cette putain d'athmosphère *BREAK* Quand j'entends une voix: "Si tu fumes un joint, tu l'tège" *BREAK* Je lui répond "mec, tu dois fumer le belge" *BREAK* Alors fuis car je suis en train de m'énerver *BREAK* Tu risques de finir avec une figure aux coins carrés *BREAK* Mais hop je fomente un complot contre un nouveau rôti chaud *BREAK* 1,2,3, c'est parti, let's go *BREAK*  *BREAK* [Couplet 9 : Akhenaton] *BREAK* Oui, la rumeur qu'on semait la terreur *BREAK* Ici fît le tour et la fureur prit de l'ampleur *BREAK* Quand Ali partit au chiottes, ce ne fut pas triste *BREAK* Un tir équivalent à Londres sous le blitz *BREAK* Le monde s'agroupa autour de la porte *BREAK* Une fille gisait là à moitié morte *BREAK* Ils s'écriaient "L'odeur est vraiment malsaine" *BREAK* Ce mec offre sa merde comme arme chimique à Saddam Hussein *BREAK*  *BREAK* [Couplet 10 : Shurik'n] *BREAK* 3 heures du mat', l'ambiance décline *BREAK* Le posse affalé tire une drôle de mine *BREAK* Normal quand on carbure au steak de houblon *BREAK* Moi j'ai exterminé un plat de sandwiches au saucisson *BREAK* Soudain le gars de la soirée me dit au revoir, c'était sympa *BREAK* Je lui ai dit, mec, baisse la tête sinon tu vas casser tes bois *BREAK* Car Chill a mis le cul de ta femme dans un très sale état *BREAK* En décodé tu viens de subir un attentat *BREAK*  *BREAK* La moralité de cette histoire : *BREAK* Si vous faites une soirée *BREAK* Le groupe IAM il ne faut pas inviter
 *BREAK* "Ta route s'arrête là, au bout de mon sabre... *BREAK*  *BREAK* [Refrain : Akhenaton & Shurik'N] *BREAK* Benkei et Minamoto *BREAK* Sabre à 2 lames *BREAK* Affûté, mon œil dans le dos *BREAK* Vois au-delà *BREAK* De l’instant figé sur la photo *BREAK* Si paisible le récit que celui qui dénie ne peut saisir *BREAK* C’est : Benkei et Minamoto *BREAK*  *BREAK* [Couplet 1 : Akhenaton] *BREAK* L’histoire, que je vais conter maintenant, s’est déroulée *BREAK* En ces temps où les champs étaient secs, les moissons amères *BREAK* Quand on portait haut l’étendard qu’on croulait *BREAK* Sous la masse ignorante, et qu’on a fui au delà de la mer *BREAK* Un beau jour de printemps, je déambulais seul *BREAK* En train de rêvasser avec la voix des maîtres dans mes oreilles *BREAK* Moi aussi je maîtrise l’art de noircir les feuilles *BREAK* Il m’a dit on m’appelle Saito Musashibo Benkei *BREAK* Et si tu veux on ira batailler côte à côte *BREAK* Toute façon que peut-on perdre ? Advienne que pourra *BREAK* Si la fin est heureuse on posera l’empreinte sur l’époque *BREAK* On restera à jamais les plus grands des samouraïs *BREAK* Depuis ce jour, nos 2 lames inséparables *BREAK* Ont tailladé les gorges trempées dans le mensonge *BREAK* Personne ne tient ces cous en laisse, on est isolé c’est pas grave *BREAK* La fin de leur règne je l’ai vu arriver en songe *BREAK* Parce qu’ils se roulent comme des porcs dans des manières ignobles *BREAK* Ils n’écoutent plus leurs cœurs, ils écoutent des cartes *BREAK* Ils se disent aigles et chantent comme des rossignols *BREAK* Loin de tout ça dans notre clan on préfère les carpes *BREAK* Jour après jour, nos techniques de sabotage *BREAK* Ont fait leurs preuves, mais en face il en arrive beaucoup *BREAK* S’il faut retenir les colères de l’orage *BREAK* Mon frère le fera dans l’honneur je partirai par Seppuku *BREAK*  *BREAK* [Pont] *BREAK*  *BREAK* [Couplet 2 : Shurik’n] *BREAK* Promenant sans répit nos ombres dans le paysage *BREAK* Déjouant les pièges et les complots, on a dû évoluer *BREAK* A terrain découvert souvent délivrant le message *BREAK* Que le vent et le temps eux-mêmes n’ont pas su altérer *BREAK* Partis sur la terre de nos maîtres, affiner nos techniques *BREAK* Au milieu des bambous de pierre, la voie s’est révélée *BREAK* Elle nous a enseigné comment avoir un style unique *BREAK* A le polir sans cesse car rien n’est jamais parfait *BREAK* Défendant notre honneur contre perfidie et traitrise *BREAK* Dos à dos ruisselant de sang dans la boue enlisés *BREAK* Si la survie dépend de notre degré de maîtrise *BREAK* Qu’Achinam garde nos ennemis où sur le sol leurs têtes pourraient rouler *BREAK* Le corps et l’esprit forgés par le feu de mille batailles *BREAK* Et sans feindre, on a porté la flamme à chacun de nos pas *BREAK* Chacun de nous, gardien de l’autre sans faille *BREAK* Et loyal, le sens de nos Haïkku possède la puissance d’un Naginata *BREAK* Depuis ce jour où mutuellement on a testé nos rimes *BREAK* J’ai croisé le fer avec mon frère dans tout le royaume *BREAK* Repoussant maintes fois les assauts de jeunes rônins avides *BREAK* Le sabre au poing, on a fait rougir toutes les scènes d’Europe *BREAK* Et si la chance vient à tourner quelque part sur la route *BREAK* Aussi sur qu’on m’appelle Benkeï, ça ne nous arrêtera pas *BREAK* Et quand leurs flèches voleront sur moi, je demeurerai debout *BREAK* Et nous partirons, lui dans l’honneur et moi la clameur des combats *BREAK*  *BREAK* [Refrain : Akhenaton & Shurik'N] *BREAK* Benkei et Minamoto *BREAK* Sabre à 2 lames *BREAK* Affûté, mon œil dans le dos *BREAK* Vois au-delà *BREAK* De l’instant figé sur la photo *BREAK* Si paisible le récit que celui qui dénie ne peut saisir *BREAK* C’est : Benkei et Minamoto
 *BREAK* La vie est belle le destin s'en écarte *BREAK* Personne ne joue avec les mêmes cartes *BREAK* Le berceau lève le voile, multiples sont les routes qu'il dévoile *BREAK* Tant pis on n'est pas nés sous la même étoile *BREAK*  *BREAK* [Couplet 1 - Shurik'n] *BREAK* Pourquoi fortune et infortune ? Pourquoi suis-je né *BREAK* Les poches vides pourquoi les siennes sont-elles pleines de thunes ? *BREAK* Pourquoi j'ai vu mon père en cyclo partir travailler ? *BREAK* Juste avant le sien en trois pièces gris BMW *BREAK* La monnaie est une belle femme qui n'épouse pas les pauvres *BREAK* Sinon pourquoi suis-je là tout seul marié sans dot *BREAK* Pourquoi pour lui c'est crèche et vacances *BREAK* Pour moi c'est stade de foot sans cage, sans filet, sans même une ligne blanche *BREAK* Pourquoi pour lui c'est l´équitation *BREAK* Pour lui la coke, pour moi les flics en faction ? *BREAK* Je dois me débrouiller pour manger certains soirs *BREAK* Pourquoi lui se gave de saumon sur lit de caviar ? *BREAK* Certains naissent dans les choux, d'autres dans la merde *BREAK* Pourquoi ça pue autour de moi,quoi ? Pourquoi tu m'cherches ? *BREAK* Pourquoi chez lui c'est des Noël ensoleillés ? *BREAK* Pourquoi chez moi le rêve est évincé par une réalité glacée ? *BREAK* Et lui a droit à des études poussées *BREAK* Pourquoi j'ai pas assez d´argent pour acheter leurs livres et leurs cahiers ? *BREAK* Pourquoi j'ai du stopper les cours ? *BREAK* Pourquoi lui n'avait de frère à nourrir ? Pourquoi j'ai dealé chaque jour ? *BREAK* Pourquoi quand moi je plonge, lui passe sa thèse ? *BREAK* Pourquoi les cages d'acier, les cages dorées agissent à leur aise ? *BREAK* Son astre brillait plus que le mien sous la grande toile *BREAK* Pourquoi ne suis-je pas né sous la même étoile ? *BREAK*  *BREAK* [Refrain] *BREAK* La vie est belle le destin s'en écarte *BREAK* Personne ne joue avec les mêmes cartes *BREAK* Le berceau lève le voile, multiples sont les routes qu'il dévoile *BREAK* Tant pis on n'est pas nés sous la même étoile *BREAK* La vie est belle le destin s'en écarte *BREAK* Personne ne joue avec les mêmes cartes *BREAK* Le berceau lève le voile, multiples sont les routes qu'il dévoile *BREAK* Tant pis on n'est pas nés sous la même étoile *BREAK*  *BREAK* [Pont] *BREAK* Je peux rien faire.. *BREAK*  *BREAK* [Couplet 2 - Akhenaton] *BREAK* Comme Issa, pourquoi je suis pas né la bonne étoile *BREAK* Veillant sur moi ? *BREAK* Tchatche à deux francs, courbettes des tapettes devant *BREAK* Supporter de grandir sans 1 franc, c'est trop décevant *BREAK* Simplement en culotte courte *BREAK* Ne pas faire la pelle mécanique plate avec des pots de yaourt *BREAK* C'est pas grave, je n'en veux à personne, et si mon heure sonne *BREAK* Je m'en irai comme je suis venu *BREAK* Adolescent incandescent chiant à tour de bras sur le fruit défendu *BREAK* Innocents, témoins de types abattus dans la rue *BREAK* C'est une enfance ? De la pourriture, ouais ! *BREAK* Je ne draguais pas, mais filait des tartes aux petites avec les couettes *BREAK* Pâle de peur devant mon père, ma sœur portait le voile *BREAK* Je revois, à l'école les gosses qui la croisent, se poilent *BREAK* C'est rien Léa, si on était moins scrupuleux *BREAK* Un peu de jeu du feu on serait comme eux *BREAK* Mais j'ai pleuré pour avoir un job, comme un crevard sans boire *BREAK* Les "je t'aime" à mes parents, seul dans mon lit le soir *BREAK* Chacun son boulet, sans ambition la vie c'est trop long *BREAK* Écrire des poèmes, pisser violent dans un violon *BREAK* Tu te fixes sur le wagon, c'est la locomotive que tu manques *BREAK* C'est pas la couleur, c'est le compte en banque *BREAK* J'exprime mon avis, même si tout le monde s'en fiche *BREAK* Je ne serais pas comme ça si j'avais vu la vie riche *BREAK*  *BREAK* [Refrain] *BREAK* La vie est belle le destin s'en écarte *BREAK* Personne ne joue avec les mêmes cartes *BREAK* Le berceau lève le voile, multiples sont les routes qu'il dévoile *BREAK* Tant pis on n'est pas nés sous la même étoile *BREAK* La vie est belle le destin s'en écarte *BREAK* Personne ne joue avec les mêmes cartes *BREAK* Le berceau lève le voile, multiples sont les routes qu'il dévoile *BREAK* Tant pis on n'est pas nés sous la même étoile
 *BREAK* Les pas d'un pauvre mec pressé le mènent à une mort certaine et précoce *BREAK* Il le sait depuis le jour où il a vu son frère échanger *BREAK* Un sachet blanc contre de l'argent avec un mec du quartier *BREAK* Alors pourquoi ne pas faire comme lui *BREAK* Il trouva de l'argent pour acheter son coin de paradis *BREAK* Un billet en première pour l'extase en charter *BREAK* C'était bien cher payer pour une jouissance éphémère *BREAK* Et aujourd'hui, telle est son existence *BREAK* Vendre des petits paquetspour assouvir sa dépendance *BREAK* Hum, et une nuit tout bascula *BREAK* Pendant qu'il vendait, une patrouille l'embarqua *BREAK* Il ne revit sa ville qu'à travers des barreaux *BREAK* Et mourrut seul avec sa dernière dose d'héro *BREAK* Il n'y eut personne pour pleurer lors de l'enterrement *BREAK* Le sachet blanc compte un mort de plus dans ses rangs *BREAK*  *BREAK* [REFRAIN x2] *BREAK* Le sachet blanc m'empoisonne le sang *BREAK* Le sachet blanc m'empoisonne la vie *BREAK* Autour de moi s'est arrêté le temps *BREAK* J'ai dû me tromper de paradis *BREAK*  *BREAK* [Couplet 2] *BREAK* Une rue sombre, une limousine s'y engage *BREAK* En face d'elle une Cadillac attend sous l'orage *BREAK* On sort la marchandise, et la petite valise *BREAK* La tension s'attise sous les gabardines grises *BREAK* Car les gars qui sont là n'ont plus rien à prouver *BREAK* Dans le style enfoiré, ils se sont affirmés *BREAK* La conscience tranquille, ils peuvent rentrer à la maison *BREAK* Sûrs et certains de ne jamais finir en prison *BREAK* Normal, ils n'arpentent pas les trottoirs et n'ont aucune idée de ce qu'est le désespoir *BREAK* Pour eux, tout n'est qu'affaire de monnaie et qu'importe le prix ils n'auront pas à le payer *BREAK* Il neige sur ma ville des flocons d'héroïne *BREAK* Le style de poudreuse qui vous plonge dans l'abîme *BREAK* Pendant que certains se frottent les mains *BREAK* Pensant à l'argent qu'ils vont amasser le lendemain *BREAK* Après ça on vous promet une guerre comme on en a jamais vue *BREAK* Contre la drogue dans la rue *BREAK* Que d'affabulation et d'extrapolations *BREAK* Sachant que le poison est à l'intérieur du bastion *BREAK* Et oui tout le monde sait : le problème ce n'est pas les dealers *BREAK* Tuer le mal à sa source ce serait bien meilleur *BREAK* Car vendre de la blanche est interdit c'est sûr *BREAK* Sauf si tu as une villa sur la Côte d'Azur *BREAK* Que tu ne te trimballes qu'en limousine *BREAK* Et que ta femme porte un manteau en zybeline *BREAK* Si tu n'as pas tout ça tu ne vis pas longtemps *BREAK* Et le sachet blanc compte un mort de plus dans ses rangs *BREAK*  *BREAK* [REFRAIN] *BREAK* Le sachet blanc m'empoisonne le sang *BREAK* Le sachet blanc m'empoisonne la vie *BREAK* Autour de moi s'est arrêté le temps *BREAK* J'ai dû me tromper de paradis *BREAK*  *BREAK* [Couplet 3] *BREAK* Poudre, poussière, la route n'est pas longue *BREAK* Elle part de la première et s'arrête à la seconde *BREAK* N'oubliant personne, ni enfant, ni homme *BREAK* Tout comme l'alcool elle détruit ceux qui s'y adonnent *BREAK* Ceux qui la font rentrer par tonnes n'en n'ont rien à faire *BREAK* Qu'une femme enceinte s'en foute plein les veines *BREAK* C'est plus fort que moi que pourrais-je leurs souhaiter d'autre *BREAK* Sinon que leur fils se drogue *BREAK* Lorsque leur compagne les regarderont en sanglotant *BREAK* Parce que la daube aura tué la chair de leur chair, le sang de leur sang *BREAK* Je leur dirai d'écouter ce soir dans la cité *BREAK* Les pas d'un pauvre mec pressé *BREAK*  *BREAK* Le sachet blanc compte un mort de plus dans ses rangs x2 *BREAK*  *BREAK* [REFRAIN] *BREAK* Le sachet blanc m'empoisonne le sang *BREAK* Le sachet blanc m'empoisonne la vie *BREAK* Autour de moi s'est arrêté le temps *BREAK* J'ai dû me tromper de paradis *BREAK*  *BREAK* Le sachet blanc *BREAK* Le sachet blanc *BREAK* Le sachet blanc *BREAK* J'ai dû me tromper de paradis
 *BREAK* On était assis à la terrasse d'un café, relax *BREAK* Deux verres de Perrier sur la table, en train de déguster une glace *BREAK* Neuf heure du soir, la place était presque pleine *BREAK* Mais pas assez pour ne pas voir arriver le phénomène *BREAK* Méditerranéenne mixée comme chez nous *BREAK* Basses, aiguës à fond, "wooou" elle envoyait la ganzou *BREAK* Elle est venue s'assoir à côté de nous, une clope cousine *BREAK* Quoi tu as ton mec ? *BREAK* Deux mètres, cent dix kilos, il s'est pointé *BREAK* Illico, aussi sec, on est retourné à nos Perriers *BREAK* Je suis pas fou, le type était balèze *BREAK* Pas question de s'embrouiller de se faire plier par Golgoth 13 *BREAK* Mais la gadji reluquait, regard aguicheur *BREAK* Elle essayait quand même de me faire du pied *BREAK* Une vodka, la commande est passée *BREAK* Son mec va au comptoir, elle nous fait glisser un billet *BREAK* "Rendez-vous à dix heures à votre appart', dites-moi où c'est *BREAK* Une copine va m’accompagner" *BREAK* Elle se leva, la main crispée sur le papier un clin d’œil discret *BREAK* La soirée était bien commencée, ouais *BREAK*  *BREAK* Refrain (x4) *BREAK* Dans toutes les situations, sans inhibition *BREAK* Elle donne son corps avant son nom *BREAK* "Tout de suite la voici sexy qu'occupe mon esprit" *BREAK*  *BREAK* [Couplet 2] *BREAK* Je préparais la pièce et les armures de latex *BREAK* Les sticks de "popo", le stand de tir sur le Bultex *BREAK* Et moi à peine arrivé en bas, elles étaient déjà là *BREAK* La pure motivation, mon gars *BREAK* Dans l'ascenseur il ne faisait pas chaud *BREAK* Mais une autre chaleur, leur fit déjà sauter les tricots *BREAK* Elles arrivèrent dans la maison en Wonderbra *BREAK* Vision irréelle, fracture nette de l’œil droit *BREAK* On leur proposa de boire ou de manger un truc *BREAK* Un cappuccino, deux sucres roux, elles aimaient le luxe *BREAK* Je leur ai dit : "Excusez-moi, prenez le bien certes *BREAK* Vous êtes raffinées mais vous avez l'air de deux filles ouvertes *BREAK* Dix secondes après c'était la cavalcade *BREAK* Et comme Jackie Chan, on a fait nous-mêmes nos cascades *BREAK* Au matin, ce ne sont que des draps que j'ai sentis *BREAK* Les cascadeuses étaient parties *BREAK* En m'habillant, je palpais mes poches vides *BREAK* Plus de chèques, plus de cartes, plus de liquide *BREAK* Le plan était simple et sans accroc *BREAK* Si on rattrape les gazières *BREAK* On a foncé au centre ville, on a aperçu les filles *BREAK* Pénétrer dans un bar américain *BREAK* Devant la porte, y'avait le type du bar, la baraque *BREAK* On a compris, mais trop tard, que ce mec était leur mac *BREAK* J'ai dû trouver un exutoire pour passer mes nerfs *BREAK* Et un skin a morflé des coups deBlack et Decker *BREAK* Traitez les filles avec respect mais attention *BREAK* Prenez garde à celles qui ne donnent pas leur nom *BREAK*  *BREAK* Refrain (x4) *BREAK* Dans toutes les situations, sans inhibition *BREAK* Elle donne son corps avant son nom *BREAK* "Tout de suite la voici sexy qu'occupe mon esprit" *BREAK*  *BREAK* "J'avais sous estimé son vice de haut niveau" *BREAK* Plus de chèques, plus de cartes, plus de liquide
