[Couplet 1 - Akhenaton] *BREAK* Il est assis au fond du métro, où personne ne regarde *BREAK* Silence pesant, trois mecs montent, visages menaçants *BREAK* "Allez, tombe la veste, on est accroc d'elle" *BREAK* Mais lui supplie, commence à pleurer, son père lui a offert à Noël *BREAK* Elle change de main, il a beau dire que ses parents n'ont pas un sou *BREAK* Au fond, tout le monde s'en fout, les trois types, les gens autour *BREAK* Gratuitement, la lame est soudaine *BREAK* L'Opinel pénètre, 10 centimètres dans l'abdomen *BREAK* Ça fait déjà un an, il aurait 16 ans *BREAK* Son père ne s'en est jamais vraiment remis *BREAK* Lorsqu'il entre dans sa chambre, rien n'a changé *BREAK* Les jouets, les livres, cependant les murs sont tristes *BREAK* Pourquoi vivre si tuer c'est facile ? On veut tourner le couteau *BREAK* Quand tout s'écroule d'un coup au fond d'un métroil gît là *BREAK* Les flics enquêtent, bouffent des sandwiches, même sourient *BREAK* Racontent leur vie, ils parlent même pas de lui *BREAK* Il a du mal à s'imaginer, jadis son enfant innocent *BREAK* En une seconde, pour 400 francsmourant dans une flaque de sang *BREAK* Une flaque de pleurs, une vague de peur *BREAK* Fruit de l'amour *BREAK* C'était pas l'heure de partir, il ne lui avait pas tout dit *BREAK* Tant pis, ce sera au Paradis *BREAK* Et des remords la racine, s'élève un arbre *BREAK* Et de l'arbre pousse des fleurs délicates qui viennent caresser le marbre *BREAK*  *BREAK* [Refrain : Nuttea *BREAK* Encore une tombe à fleurir *BREAK* Un ange part dans un dernier soupir *BREAK* Un fait divers dans une ruelle *BREAK* Un cri court, personne n'entend l'appel *BREAK*  *BREAK* [Couplet 2 *BREAK* Rue sombre, éclairée aux néons, deux heures déjà *BREAK* Qu'elle fait les cents pas et dans le sac toujours pas un rond *BREAK* Trottoirs glauques, bars sales, bagarres d'ivrognes *BREAK* Les talons frappent le goudron, au feu rouge un mec klaxonne *BREAK* Elle en a marre de ces tarés qui passent, repassent, la condamnent *BREAK* Blessent son âme et dix mètres plus loin se marrent *BREAK* Ça marche pas bien aujourd'hui, les mecs n'ont pas envie *BREAK* À cause de la pluie ou la vie, le sexe perd face au souci *BREAK* Un manteau, un parapluie, l'enfer en costume gris *BREAK* Se rapproche, son regard fuit, elle dit son prix, c'est parti *BREAK* S'ouvre la porte, couloir vers le purgatoire *BREAK* Tourne tel un train fantôme de foire, de sa rue au glissement des bas noirs *BREAK* Miroir, dis-lui qui est la plus belle *BREAK* Ne la laisse pas croire seule le soir, que les fées *BREAK* Belle au bois dormant sur un matelas sans ressort *BREAK* Ancrée à son sort comme un bateau usé, jamais ne sort du port *BREAK* Blanche-Neige a croqué le fruit amer sans amertume *BREAK* Pour eux, elle n'est qu'un pute, pour son fils elle reste une mère *BREAK* Une peau d'âne princesse le jour esclave la nuit *BREAK* Mais les escarpins *BREAK* Les murs témoins de l'étreinte plus brève que tendre *BREAK* Capturent son regard rêveur, seul remède contre la démence *BREAK* Sorti par la fenêtre un cri sans bruit *BREAK* Sorti par la fenêtre un cri court dans la nuit *BREAK*  *BREAK* [Refrain : Nuttea] X2 *BREAK* Encore une tombe à fleurir *BREAK* Un ange part dans un dernier soupir *BREAK* Un fait divers dans une ruelle *BREAK* Un cri court, personne n'entends l'appel
Offishall *BREAK*  *BREAK* Akhenaton : *BREAK* Tassés dans les bateaux, sur un pont crado *BREAK* 1000 bouches à nourrir, sur le même gâteau *BREAK* Tous prêts à mourir, pourvu qu’il accoste *BREAK* Forcés à sourire, quartier de Vatos *BREAK* Mains qui manipulent la découpe du matos *BREAK* Ballottées entre livres, stylos et bastos *BREAK* L’égalité, ouais, on connaît la chanson *BREAK* Tu peux noter, on est les champions *BREAK* Bons pour la leçon, nuls pour l’action *BREAK* Sauf trique, bâton, charter, maton *BREAK* Le son vient des bas fonds, volume à fond *BREAK* Villes sous pression, on approche du plafond *BREAK* Quelques casses pieds y kiffent la baston *BREAK* Y'a plus de familles, que d’ânes sous cachetons *BREAK* De gars sous tension, de casques et plastrons *BREAK* De gaz et pin-pon, de toutes les façons *BREAK*  *BREAK* [Refrain] *BREAK* Un jour au Sénat, on sera offishall *BREAK* Dans les pubs à la télé on sera offishall *BREAK* On mendie pas, on pleure pas, on râle pas *BREAK* On dort pas, on meurt pas, on construit, on veut être offishall ! *BREAK* Sur le mic dans les clubs déjà offishall *BREAK* Dans le sport de haut niveau on est offishall *BREAK* On mendie pas, on pleure pas, on râle pas *BREAK* On dort pas, on meurt pas, on construit, on veut être offishall ! *BREAK*  *BREAK* Shurik'n : *BREAK* Ils veulent bien de nous, ça fait exotique *BREAK* Aller retour, Paris les îles *BREAK* Et ils ont peur de nous, ça c’est pas logique *BREAK* Ils font leurs shoppings c’est nous leurs vigiles *BREAK* Ils disent qu’il y a trop de noirs dans leurs bleus *BREAK* D’arabes dans les clubs *BREAK* De rap dans les subs *BREAK* Et pourtant nous c’qu’on veut *BREAK* C’est plus d’avocats débarqués d’en bas *BREAK* Des sièges au Sénat *BREAK* Je veux des frères en blouses blanches, grands chirurgiens (bsartek le scalpel !) *BREAK* Chercheurs ou médecins *BREAK* Des frères dans les cocktails pas pour le service *BREAK* Justice, peu de nous la rendent et trop la subissent *BREAK* Nous on pense métisse, eux pensent uniforme *BREAK* Hors des normes, on glisse *BREAK* Ici y'a beaucoup trop de portes *BREAK* Ils veulent bien nos médailles *BREAK* Pas nos faces à Versailles *BREAK* Pas de parking privé *BREAK* Pas de place réservée *BREAK*  *BREAK* [Refrain] *BREAK* Un jour au Sénat, on sera offishall *BREAK* Dans les pubs à la télé on sera offishall *BREAK* On mendie pas, on pleure pas, on râle pas *BREAK* On dort pas, on meurt pas, on construit, on veut être offishall ! *BREAK* Sur le mic dans les clubs déjà offishall *BREAK* Dans le sport de haut niveau on est offishall *BREAK* On mendie pas, on pleure pas, on râle pas *BREAK* On dort pas, on meurt pas, on construit, on veut être offishall ! *BREAK*  *BREAK* Akhenaton : *BREAK* Ils s’vendent comme des crackers, nous comme des braqueurs *BREAK* Fonds de commerce alimenté par la peur *BREAK* Coupe de la FIFA, juin 2006 *BREAK* Débat : y a-t-il trop de noirs dans l’équipe ? *BREAK* Est-ce que les français se reconnaissent dedans ? *BREAK* La question a disparu dès la première victoire *BREAK* N’est ce pas minable ? Ça c’est des hommes ? *BREAK* Tuent tes illusions, c’est un pays de gnomes *BREAK*  *BREAK* Shurik'n : *BREAK* Mec, on est souvent accusés, rarement candidats *BREAK* Eux, n’ont qu’un pas à faire, là où nous on en fait 3 *BREAK* Oubliés mais surmédiatisés, dès qu’on bouge un bras *BREAK* Ils nous aiment pas, mais le cul de nos sœurs, ça leur déplait pas *BREAK* Toujours la même image, rap, danse, foot et baskets *BREAK* Tout dans le cliché, ça va pas changer en 2007 *BREAK* On parle d’une femme présidente, ça fait grincer les dents *BREAK* Alors comprends que pour les noirs faudra repasser dans 100 ans *BREAK* Mais *BREAK*  *BREAK* Refrain (2x) *BREAK* Un jour au Sénat, on sera offishall *BREAK* Dans les pubs à la télé on sera offishall *BREAK* On mendie pas, on pleure pas, on râle pas *BREAK* On dort pas, on meurt pas, on construit, on veut être offishall ! *BREAK* Sur le mic dans les clubs déjà offishall *BREAK* Dans le sport de haut niveau on est offishall *BREAK* On mendie pas, on pleure pas, on râle pas *BREAK* On dort pas, on meurt pas, on construit, on veut être offishall !
 *BREAK* Fais ci et ça mets-toi là ne la ramène pas *BREAK* De ton avenir ce sont les principes de base *BREAK* J'ai pris ce chemin pendant pas mal d'années c'est vrai *BREAK* Puis vint le jour où je décidais de m'évader *BREAK* Me libérer de chaînes devenues trop lourdes à porter *BREAK* Sans me soucier du fait qu'il me faudrait recommencer *BREAK* J'ai donc suivi le chemin emprunté par tous ces gens *BREAK* Qui eurent envie enfin de vivre leur vie pleinement *BREAK* Y en a marre d'être obligé 5 jours par semaine *BREAK* De se frapper un boulot auquel on pense à peine *BREAK* Mais que l'on prend parce qu'on a pas le choix *BREAK* Sinon pas de travail pas d'argent et donc aucun droit *BREAK* Alors soit OK j'aurai un métier *BREAK* Mais pas n'importe lequel, je le choisirai *BREAK* Car d'autres ont pu faire ce choix alors pourquoi pas moi *BREAK* Question de volonté, de courage de foi *BREAK* Et tant que j'aurai le privilège d'être sur scène *BREAK* De sentir la chaleur s'accroître dans mes veines *BREAK* Je garde mon micro, au diable les repas gamelle *BREAK* J'ai trop de choses à dire je reste ne vous en déplaise *BREAK* Seulement voilà je fais du rap et non de la variété *BREAK* Les problèmes vont affluer *BREAK* Normal la franchise est de rigueur *BREAK* Cela risque fort de gêner certains beaux parleurs *BREAK* Qui voudront nous boycotter nous empêcher de clamer *BREAK* Ou réclamer la vérité chose qu'ils n'ont jamais donnée *BREAK* Pas de chance rien ne m'arrête je demeure actif *BREAK* Et loin de nos obligations je reste un fugitif *BREAK*  *BREAK* [Refrain] *BREAK* ‘’Hasta la vista’’ *BREAK* Un fugitif et aucune barrière ne m’arrête *BREAK* Un fugitif *BREAK* ‘’Hasta la vista’’ *BREAK*  *BREAK* [Couplet 2] *BREAK* Courrez courrez jamais vous ne me rattraperez *BREAK* Et quand bien même vous le feriez vous n'auriez pas gagné *BREAK* Mon esprit est complexe il nous faudrait tout effacer *BREAK* Mes idées sont sur un fichier vous n'avez pas le code d'accès *BREAK* Encore un qui vous échappe putain quelle poisse ! *BREAK* De plus c'est un Noir et cela vous agace ! *BREAK* Cherchez la solution faites vous une raison *BREAK* J'y étais j'y étais hop disparition *BREAK* Ha ! Je suis à présent libéré de mes contraintes *BREAK* Quotidiennes normal je fais un boulot que j'aime *BREAK* Mais qui vous déplait car je dévoile les faits *BREAK* J'en ai fait ma profession il me faudrait un siècle entier *BREAK* Pas de problèmes je relève le défi et j'enchaîne *BREAK* Brise mes chaînes et poursuis ma route quoi qu’il advienne *BREAK* Comme tout le monde ici bas j'essaye de faire ma place *BREAK* Dans le marécageux dédale de la réussite sociale *BREAK* Comment voudriez-vous qu'il en soit autrement *BREAK* Vous vous en sortez si bien en magouillant ? *BREAK* Et franchement arrêtez de nous prendre pour des branquignoles *BREAK* Sur Mars côté business on n'est pas des guignols *BREAK* Et puis on a bien d'autres choses à faire *BREAK* Que de vous regarder bouche-bée mettre à sec nos artères *BREAK* Voilà pourquoi de tout côté on nous siffle *BREAK* Chaque jour un esprit s'éveille et devient par là un fugitif *BREAK*  *BREAK* [Refrain] *BREAK* ‘’Hasta la vista’’ *BREAK* Un fugitif et aucune barrière ne m’arrête *BREAK* Un fugitif *BREAK* ‘’Hasta la vista’’ *BREAK*  *BREAK* [Couplet 3] *BREAK* Chacun fait ce qu'il peut en fonction de ses moyens *BREAK* Certains n'ont pas le choix d'autres ont plusieurs chemins *BREAK* Il est prouvé que l'habitude immanquablement *BREAK* Et les morales fragiles finissent par boire la tasse *BREAK* Puis se jettent dans un remède qui n'est pas le bon, certes *BREAK* Mais qui fait qu'ils n'ont plus l'air de masses inertes *BREAK* Ça c'est leurs problèmes je n'ai pas besoin de ça *BREAK* Ni de vous ni de rien d'autre seulement ma voix *BREAK* Vous aimeriez me supprimer ce choix *BREAK* D'être sur scène et d'allouer la faute à qui de droit *BREAK* Ah ! Laissez-moi rire et de vous à moi *BREAK* C'est pas demain la veille que cela se fera *BREAK* J'ai jamais eu envie d'être un jeune cadre dynamique *BREAK* De faire des courbettes devant un PDG trop hypocrite *BREAK* Je préfère de loin l'ambiance des concerts *BREAK* Sentir qu'avant d'entamer le show mon estomac se serre *BREAK* Voir des gens délirer, Danser sur ma musique *BREAK* Me dire que je suis utile, fantastique *BREAK* Évidemment vous ne pouvez pas en dire autant *BREAK* Pas étonnant les heureux que vous faîtes sont de notre gang *BREAK* Aussi restez dans vos pantoufles et lâchez-moi les baskets *BREAK* J'ai choisi ma route et Soul Swing épaule ma quête *BREAK* Surtout n'essayer rien de toute façon, esquive *BREAK* Bye bye hasta la vista, et bien le bonjour d'un fugitif ! *BREAK*  *BREAK* [Outro + Scratches]
[Refrain] (x2) *BREAK* On se fait pas d'illusion *BREAK* On flirte avec la bordure *BREAK* Dur de marcher droit dans un pays tordu *BREAK* On pétrit de talent voué a l'école *BREAK* On est ces maîtres carrés, qui tournent en rond dans l'hexagone *BREAK*  *BREAK* [Pont 1] *BREAK* "Ceux qui marchent de travers exigent de toi que tu files droit" *BREAK* "Tout les jours chasser l'ennui sur les marches" *BREAK*  *BREAK* [Couplet 1 - Shurik'n] *BREAK* On nous a dit de s'accrocher, de penser à l'avenir *BREAK* De se donner les moyens de choisir ce qu'on voulait devenir *BREAK* Mais c'est pas si facile, aucun minimum garantit *BREAK* Un BAC +6 au RSA, on sait que rien n'est écrit *BREAK* Aucun nom gravé sur les bancs, avant que le sang ne s'en mêle *BREAK* On a beau retrousser les manches ou se donner de la peine *BREAK* Ils veulent du mouton et gras qui répond à l'appel *BREAK* Et si l'un d'eux prend son envol ils lui coupent les ailes *BREAK* Cherche pas de tremplin sur la route, ils l'ont remplit de colle *BREAK* Le tri est fait sans que tu le saches sur les bancs de l'école *BREAK* La donnée est faussée, tout autour trop de fossés *BREAK* Et l'étrange impression que tout ici n'est fait que pour t'enfoncer *BREAK* Ils tiennent les rennes, et nous font tourner en rond *BREAK* Accrochés à leur sièges, leurs privilèges et nous pris au piège *BREAK* On continue à espérer le Paradis *BREAK* Coincés à vie, dans la géométrie de l'ennui *BREAK*  *BREAK* [Refrain] (x2) *BREAK*  *BREAK* [Pont 2] (x2) *BREAK* "Cloué sur un banc, rien d'autre à faire" *BREAK*  *BREAK* [Couplet 2 - Akhenaton] *BREAK* C'est l'heure des potes, arrête un peu avec le karma *BREAK* Ça pue l'Alabama, ici on verra jamais d'Obama *BREAK* Et personne n'en a réellement envie *BREAK* On dilue nos cris, dans la géométrie de l'ennui *BREAK* Du hall au mur, du mur aux marches, des marches au banc *BREAK* Du costume de pirate à la cagoule et au gant *BREAK* Lève les yeux voit les arbres pleins de fruits à branches *BREAK* La coke' c'est le salaire et ce qui les étrangle *BREAK* Les vieux de '68 restent pleins de postes *BREAK* Ils disent être nos pères mais s'accrochent aux clés de la bagnole *BREAK* Ce qu'on vit, eux ils le mettent en théorie *BREAK* Et dans les diners en privé, leur mépris est horrible *BREAK* Ils aiment ce rap qui sonne rock ou Y'a bon Banania *BREAK* Surtout pas qui s'affranchit et qui n'est pas maniable *BREAK* Destiné à quitter l'usine par le train d'7 heures *BREAK* On fait vos putain d'modes, on est vos 37 heures *BREAK* On est les bons leurres, d'un pays qui dit non qui le nie *BREAK* Cette haine on la vit, et on l'affronte pour nos petits *BREAK* Le blanc, c'est qu'y en a pas alors on fuit on s'oublie *BREAK* Coincés quelque part, dans la géométrie de l'ennui *BREAK*  *BREAK* On est ces mec carrés, qui tournent en rond dans l'hexagone
 *BREAK* Assis observer l’horizon *BREAK* Besoin d’espace... pour les rêves *BREAK* Assis observer l’horizon *BREAK* Besoin d’espace... les pieds sur terre *BREAK*  *BREAK* [Couplet 1 - Shurik'n] *BREAK* Je dois rester hors de leur toile loin de ces vérités sous voile *BREAK* Voir plus loin que la raison comme le souvenir souvent triomphant *BREAK* De l'oraisonl'entrave n'est que physique *BREAK* Ils sont légion *BREAK* Vois ces myriades de bombes souffler autant de sourire sans excuse aucune *BREAK* Une vie d’chien vaut rien, celle d'un gosse c'est pire *BREAK* Nous dire que c'est pour le bien c'est n'ouvrir qu'une fenêtre sur un mur *BREAK* Où l’billet fait papier peint quand la vue est restreinte, on pense bien moins *BREAK* J'irais plus loin qu’ça, plus loin que ceux qui croient plus loin que cette place de parking *BREAK* Où gît mon nom gravé sur une pancarte noire, j'veux pas de leurs horizons *BREAK* Abyssale prison où l'mensonge tombe comme au temps de la mousson *BREAK* Si je bois le bouillon, j'entraîne le moussaillon *BREAK* Je veux pas d’leur solution, elles ont l’goût de poison *BREAK* J’serai pas le bâton frappant les rejetons, ils me feront pas croire *BREAK* Qui y'a qu'là qu'on est bon, brandir le tison *BREAK* La haine attisée, assis au coin à tiser, on s’fait facilement hypnotiser une fois alcoolisés *BREAK*  *BREAK* [Refrain - Akhenaton] (X2) *BREAK* Tout c'qui est visible est visable, vies, cibles et mirages *BREAK* Défends avec ardeur tout c'qui est miscible et bizarre, douille et visage *BREAK* Emaciés, trait visible, héritages, missiles et sillages *BREAK* Missive et visa, illisible épitaphe *BREAK*  *BREAK* [Couplet 2 - Akhenaton] *BREAK* Bâillonné à l'âge tendre, élevé pour usiner *BREAK* A force de rien y voir, j'ai cru qu'à 16 ans ils allaient m'fusiller *BREAK* Gosse que c'bled ne veut pas reconnaître, par peur peut être *BREAK* Le béton s'est écarté, ma feuille est devenue cette formidable steppe *BREAK* Aussi loin qu'j'me rappelle, au crépuscule, j'pensais qu'le globe *BREAK* Solaire chutait dans la mer et s'noyait, décès sans appel *BREAK* Laissé sans affaires, intersection vitale, où les grands s'affairent *BREAK* Seul dans ces lieux par manque d'argent ça ferme *BREAK* Illuminé par l'unique faisceau naturel, dans c'monde vénal *BREAK* J'ai survécu à 2 plongées en apnée dans l'Etna *BREAK* Mirage matriciel où la réussite est cruciale *BREAK* Ils m'ont braqué, pris ma part du ciel, celle qu'on voit des rues sales *BREAK* Du poivre et du sel, dans un jour fade, j'fus l'hirondelle *BREAK* Absent des marches et des murs au seuil d'une journée froide *BREAK* Aujourd'hui ils m'inondent de ciment, et si j'mens, j'tombe vivement *BREAK* Ici pour du vent, on te stoppe si facilement *BREAK*  *BREAK* [Refrain - Akhenaton] (X2) *BREAK* Tout c'qui est visible est visable, vies, cibles et mirages *BREAK* Défends avec ardeur tout c'qui est miscible et bizarre, douille et visage *BREAK* Emaciés, trait visible, héritages, missiles et sillages *BREAK* Missive et visa, illisible épitaphe *BREAK*  *BREAK* [Couplet 3 - Freeman] *BREAK* Quand j'étais p'tit, déjà, seul, j'rêvais de l'infini, où la lumière finit *BREAK* Où tout s'unit, où personne nie, c'qu'on dit *BREAK* Mais bon, ici, on est pas parfait, donc j'ai avancé, au milieu d'empaffés *BREAK* Coincés dans leurs cultures arriérées *BREAK* Moi, j'voulais m'aérer, errer, opérer un changement qu'on verrait *BREAK* Histoire d'voir plus loin, qu'les autres *BREAK* Qui, serrés autour d'nous, c'était normal d'voir un proche qui coulait *BREAK* La foi permettait seulement d'être ailleurs, quand on voulait méditer *BREAK* Métissée, mon odyssée, dans l'mal, j'voulais pas glisser *BREAK* J'voulais hisser, l'bien, aux d'sus d'tout *BREAK* Car l'espace c'est l'pouvoir, qui contrôle, et organise *BREAK* L'sens du terrain, la liberté, et l'free c'est la balise *BREAK* Là d'dans, c'est quoi que j'visais, mon mode de vie, fallait l'réviser *BREAK* Quitter la guigne et ces bancs, pour aller visiter les étoiles *BREAK* Elles sont liées à nous, comme on l'est avec nos gosses, man *BREAK* Le but final, c'est d'éviter l'mauvais sort qui condamne *BREAK*  *BREAK* [Refrain - Akhenaton] (X2) *BREAK* Tout c'qui est visible est visable, vies, cibles et mirages *BREAK* Défends avec ardeur tout c'qui est miscible et bizarre, douille et visage *BREAK* Emaciés, trait visible, héritages, missiles et sillages *BREAK* Missive et visa, illisible épitaphe *BREAK*  *BREAK* ‘’Voyager vers l’horizon’’ *BREAK* ‘’Voici, voici la vérité’’ *BREAK* ‘’Raser le temps pour l’éternité’’
 *BREAK*  *BREAK* [Couplet 1 : Akhenaton] *BREAK* Mon histoire de France à moi commence par un génocide *BREAK* Ces pensées maussades romancent une revanche impossible *BREAK* On est tous fils de la Qibla *BREAK* Nous on maquille ces putains d'feuilles immaculées en nuit bleu *BREAK* Ils brandissent la Bible et mettent Jésus au cœur de l'intox *BREAK* Ils nous ciblent avec la rabla comme du fly-tox *BREAK* Moi j'revendique ma différence dans ce pays merdique *BREAK* Doucement ! *BREAK* En douce m'man, t’inquiète on fait des sous sous l'manteau car tous mentent *BREAK* Comment leur faire croire ? *BREAK* C'est qu'il y pas que des cancres là *BREAK* Moi j'm'ancre là, mon encre là bave des cancrelats *BREAK* Mon âme striée par les vicissitudes *BREAK* Glace un cœur froid d'habitude *BREAK* Noir de bitume, la vie c'est l'vice à l'étude *BREAK* Vu d'en haut y'a pas de frontière c'est géant, dans l'néant *BREAK* Les néons flashent, amenés en galère, en bas c'est un fion béant *BREAK* Dans chaque part le recueil de notre juste lutte ainsi Dieu *BREAK* L'a voulu, édifiant, et nous méfiant, insidieux *BREAK*  *BREAK* [Refrain] *BREAK* All : Independenza ! *BREAK* Independenza *BREAK* Grise la verdure persiste, vise et mise là *BREAK* All : Independenza ! *BREAK* Que tous ces chiens crient « viva sentenza » *BREAK* Le maquis nous berce, nous on y perche des potenza *BREAK* All : Independenza ! *BREAK* Mike liberta, mike une berta *BREAK* La vie est mal faite et pour beaucoup elle finit barda *BREAK* All : Independenza ! *BREAK* Que se remplit de sales principes, gise là *BREAK* Grise la verdure persiste, vise et mise là *BREAK*  *BREAK* [Couplet 2 : Freeman] *BREAK* Free, l'indifférence trie les conséquences qui défient *BREAK* Méfie, l'insouciance s'lie *BREAK* Mars by night line out, mic branché, j'débarque pas d'un boat *BREAK* Sur beat on m'note, sur orbite je les écris mes notes *BREAK* Pas un scoop, Independenza pour nos troupes au complet *BREAK* Propageons l'plastique dans les foyers *BREAK* Mieux qu'un amant exempté d'voir, d'aller dans l'allée ou j'devais être *BREAK* J'trouve mon chemin, j'tombe sur terre une comète Halley *BREAK* Mes motifs sont bien meilleurs que mes méthodes *BREAK* Ton tube cathodique allume-le, voila l'histoire rapologique *BREAK* Fantasmagorique, ma prod mieux qu'une drogue *BREAK* Euphorique, quand les tiens sur nos sons s'tordent *BREAK* Vas-y, qu'on braque les faisceaux sur nous *BREAK* Chacun détient son réseau chez vous *BREAK* Kho dans l'vice, les crocs s'vissent tôt *BREAK* Le monde s’agresse, se graisse, régresse, dresse ton bilan *BREAK* Ce qu'ils bombent ici c'est pour leur adresse *BREAK*  *BREAK* [Refrain] *BREAK* All : Independenza ! *BREAK* Que tous ces chiens crient « viva sentenza » *BREAK* Le maquis nous berce, nous on y perche des potenza *BREAK* All : Independenza ! *BREAK* Mike liberta, mike une berta *BREAK* La vie est mal faite et pour beaucoup elle finit barda *BREAK* All : Independenza ! *BREAK* Que se remplit de sales principes, gise là *BREAK* Grise la verdure persiste, vise et mise là *BREAK* All : Independenza ! *BREAK* Que tous ces chiens crient « viva sentenza » *BREAK* Le maquis nous berce, nous on y perche des potenza *BREAK*  *BREAK* [Couplet 3 : Shurik'n] *BREAK* Regarde ces lumières étranges *BREAK* Oranges, tu crois que c'est le pays qui change *BREAK* Franchis le tunnel de l'Estaque *BREAK* Pense qu'ici plus qu'ailleurs la différence est une valeur *BREAK* L'indépendance dans toute son ampleur et rien à voir avec la chaleur *BREAK* Mais ça bouge dans tous les sens *BREAK* Les gens bossent, créent, tentent leur chance, osent *BREAK* À force de ne rien avoir, tu fais de grandes choses, avec des bouts de craies *BREAK* Le ciel toujours sur mais pas assez dans la tête *BREAK* Ça devient de plus en plus dur, il y a un képi pour une casquette *BREAK* Les cœurs battent en cœur, les stylos saignent à flots *BREAK* Trop de jeunes s'ouvrent les veines parce que trop de maux *BREAK* Alors on pose des mots sur une démo, on le crie bien haut *BREAK* La sale race n'est pas prête pour le tombeau, les braves tombent au combat *BREAK* Vois les balcons pleins de drapeaux, on est dans de beaux draps *BREAK* Rien, ça file la rage même quand les cages serrent comme des corsets lacés *BREAK* Le cor sonne le jour annonce, et là, ça va se corser *BREAK* Trop pressurisé, la scission guette sur sillon là *BREAK* IAM sévit dans le maquis au nom de l'Independenza *BREAK*  *BREAK* [Refrain] *BREAK* All : Independenza ! *BREAK* Mike liberta, mike une berta *BREAK* La vie est mal faite et pour beaucoup elle finit barda *BREAK* All : Independenza ! *BREAK* Que se remplit de sales principes, gise là *BREAK* Grise la verdure persiste, vise et mise là *BREAK* All : Independenza ! *BREAK* Que tous ces chiens crient « viva sentenza » *BREAK* Le maquis nous berce, nous on y perche des potenza *BREAK* All : Independenza ! *BREAK* Mike liberta, mike une berta *BREAK* La vie est mal faite et pour beaucoup elle finit barda

