 *BREAK* Tout droit de la pyramide une nouvelle analyse *BREAK* De celle que l'on apprécie basée sur la bétise *BREAK* Je me rappelle 4 ans en arrière *BREAK* Tout le monde se passionnait pour les routières *BREAK* Les texanes et le Levi's étaient de rigueur *BREAK* Les Rays Bans sur le nez et les gros bombers *BREAK* Barbe Barbe de 3 jours à la George Michael *BREAK* Le casque au bras pour ne pas cacher la belle gueule *BREAK* Tout allait bien les filles aimaient ça *BREAK* Oui mais voilà un beau jour Mickey arriva *BREAK* Est-ce une passion ou un luxe ? *BREAK* Est-ce un must ou ton cyclo t'offusque ? *BREAK* Parle-moi vas-y n'ai pas peur dis-moi *BREAK* C'est le top pour la drague je le savais déjà *BREAK* Tu l'as voulu maintenant tu pleures ta thune *BREAK* Parce que ce crado de Mickey Rourke en a une *BREAK* Le bandana est en option *BREAK* Superbes crissements de pneus *BREAK* Aussi tu perds de mon estime *BREAK* Là tu dépasses les bornes *BREAK* Tu as de l'allure à part tes deux cornes *BREAK*  *BREAK* [Refrain] *BREAK* Je ne peux plus voir personne en Harley Davidson *BREAK* Les laids se la jouent trop homme en Harley Davidson *BREAK*  *BREAK* [Couplet 2 – Akhenaton] *BREAK* Des membres du sexe féminin adorent l'ivresse *BREAK* Le vrombissement du moteur la vitesse *BREAK* Elles font tout pour monter derrière accrochées dans ton dos *BREAK* Aiment-elles ta personne ou bien ta moto ? *BREAK* S'encanaillent avec des racaillons pleins de chaines *BREAK* Étudiant la semaine biker le week-end *BREAK* Même si ton humour dans la niaiserie glisse *BREAK* Elles s'en tapent elles ont dix patates entre les cuisses *BREAK* Lorsqu'elles te larguent déçu tu t'aperçois *BREAK* Que le siège en cuir les a plus touchés que toi *BREAK* Voilà pourquoi tu as changé des opinions *BREAK* Parce que sinon tu étais bon pour la masturbation *BREAK* Du coup tu portes des gilets en cuir et des foulards *BREAK* 2 en 1 Davidson et Marlboro man *BREAK* Tu joues les durs et les vrais rebelles *BREAK* Tu te dis que tu vas te faire les plus belles *BREAK* Ton fantasme bien sûr c'est Daytona beach *BREAK* Alors tu trippes sur le high way de la corniche *BREAK* Tee-shirt blanc lunettes noires les cheveux au vent *BREAK* Pas de casque et vlan un P.V. dans les dents *BREAK*  *BREAK* [Refrain] *BREAK* Je ne peux plus voir personne en Harley Davidson *BREAK* Les laids se la jouent trop homme en Harley Davidson *BREAK*  *BREAK* [Couplet 3 – Shurik’n] *BREAK* C'est vrai ça fait branché de boire de l'Adelscott *BREAK* De jouer à la horde sauvage avec tes potes *BREAK* Années 60 les chaussures et le froque *BREAK* Dis-moi tu mets aussi les slips q'ils avaient à l'époque *BREAK* Alors on se sent fort avec du cuir sur le citron *BREAK* Avec des bottes carrés on se prend pour Marlon *BREAK* On fait le révolté contre la société *BREAK* On fait des défilés de fringues sur la rue St Fé *BREAK* Le style loubard il n'y a pas à dire ça jette *BREAK* Faut pas faire chier Bebert quand il répare sa pétrolette *BREAK* Tu prends l'air méchant ça attire les minettes *BREAK* Mais tu vis encore chez maman petite jeunette *BREAK* Tu n'es pas easy plulôt pâle rider en personne *BREAK* Harg !!! T'es laid en Davidson *BREAK*  *BREAK* [Couplet 4 – Akhenaton] *BREAK* A te voir frimer sur la route *BREAK* On se demande si le casque sert à protéger le coude *BREAK* Lunettes de soleil en pleine nuit tu m'étonnes *BREAK* Que tu ne voies plus personne en Harley Davidson *BREAK* Bonne bourre ! Non je ne suis pas jaloux *BREAK* Mais j'en ai assez des laids qui au point mort font vroum *BREAK* Qui pour étre branchés alimentent le boum *BREAK* L'éthologue caustique sur leurs moeurs fait un zoom *BREAK* Mad Max le trip aventure tu y goûtes *BREAK* Mais tu es un moute un petit moineau de la route *BREAK* Alors on cabre au cours Lieutaud au bar on est carbo *BREAK* On fait le mac mal rasé une gratteuse dans le dos *BREAK* Arrête arrête muchacho tu m'as saoulé *BREAK* Motard pour l'année, intermittent de la Harley *BREAK*  *BREAK* [Refrain] *BREAK* Je ne peux plus voir personne en Harley Davidson *BREAK* Les laids se la jouent trop homme en Harley Davidson
 *BREAK* Nous étions seuls sur la plage et tu étais belle à rêver *BREAK* Nous nous sommes regardés un instant, tu m'as dit alors *BREAK* Oublie tes soucis, glisse dans mes bras, je me suis approché *BREAK* Pour t'embrasser…" *BREAK*  *BREAK* "Ouais ce qui m'intéresse dans mes chansons *BREAK* C'est de parler de choses dont jamais personne n'a parlé avant, tu vois *BREAK* Sublimer des émotions rarement vécues par le commun des mortels *BREAK* Quand j'ouvre la bouche *BREAK* Y a 20 millions de Français qui pleurent ! Moi aussi !"
 *BREAK* Je veux rester seul *BREAK* J'ai peur j'ai froid *BREAK* Je veux rester seul *BREAK* Achevez-moi *BREAK* Assis dans le coin d'une pièce *BREAK* Je souhaiterais me faire sauter la caisse *BREAK* Je rêve en secret de vacances en Pologne *BREAK* Dans des usines cold *BREAK* J'aime le marbre et les habits noirs *BREAK* Sortir quand il y a 800 milibars *BREAK* Je me sens comme attiré par le vide *BREAK* Le suicide *BREAK* Enfermez-moi dans mon placard *BREAK* Venez m'ouvrir qu'un an plus tard *BREAK* Achevez-moi pour mettre un fond dans mon gouffre… *BREAK* Je souffre *BREAK* Je veux rester seul… *BREAK* J'ai peur j'ai froid *BREAK* Je veux rester seul *BREAK* Achevez-moi…
 *BREAK* Au nom des vers, du rythme et du sample aussi *BREAK* Toujours présents, vois tout ce qu'on lui sacrifie *BREAK* Tu le sais dévoués même sans le succès *BREAK* Cette voix nous reforment, nos voix la renforcent *BREAK* On sait pour qui on l'fait *BREAK* Comme la muraille de Chine, on affronte le temps *BREAK* Résiste au vent, conquérants, compacte est le team *BREAK* Hardcore, d'accord, mais sonore est le crime *BREAK* Une main droite vers le firmament et l'autre à nos racines *BREAK* Pour faire briller les yeux, garder les nôtres ouverts *BREAK* Donner du miel au corps lorsque la vie devient sévère *BREAK* Faire que les frères vibrent avant que tout s'écroule *BREAK* Et que les fachos flippent à chaque fois qu'on approche les foules *BREAK* Parce que la rue a plus d'enfants que jamais *BREAK* Et dame confiance n'est plus, le pognon l'a violée *BREAK* C'est une mission à vie pas un CDD *BREAK* À l'heure où tous plient, serrez les coudes et ne pas céder *BREAK* L'aliment suprême, c'est vital pour les miens *BREAK* Nos âmes s'engavent à chaque nouveau festin *BREAK* Au creux de ses mains, l'esprit abaissé *BREAK* On cherche pas le Graal, tout c'qu'on veut c'est exister par là... *BREAK*  *BREAK* [Refrain - Said] X2 *BREAK* Musique ! *BREAK* Bouffée d'oxygène *BREAK* Quand le ciel s'assombrit... *BREAK* Chaque jour on vit sur ses ailes elle s'appelle... *BREAK*  *BREAK* [Couplet 2- Akhenaton] *BREAK* Au nom du flow, des rimes et du sens aussi *BREAK* On est supposés poser les couplets les plus "bad" possibles *BREAK* On a le gros son dans l'sang, le silence ici on le saigne *BREAK* Le seum, on se sent bien hein, pourquoi changer de chaise ? *BREAK* Pour un peu de lumière en plus ? Nah c'est pas la peine ! *BREAK* On porte ça dans les veines, depuis l'époque où on partait jouer en bus *BREAK* Qu'on partageait les 5 billets de 100 francs après le live comme des crèves *BREAK* Une façon de vivre, parfois illisibles *BREAK* Par nos proches, c'est dire si les autres hésitent *BREAK* À nous voir dans le vrai, le temps passe comme les illusions *BREAK* Les bras se sont encrés de noir *BREAK* Et nos pensées quand on rentrait le soir *BREAK* On voulait changer le monde, le monde nous a changés, l'espoir *BREAK* Les intentions roulées dans le blé *BREAK* Et les p'tits chimpanzés on danse sur leurs falaises en craie *BREAK* Peu importe ce qu'il y a écrit dans les colonnes *BREAK* Guerlain on l'emmerde on a grandi à l'eau d'Cologne! *BREAK* Dans notre univers, on ne sait même pas qui c'est *BREAK* J'me sens comme Travolta qui va au 2001 Odyssey *BREAK* On est des Tony Manero du rap *BREAK* La passion...un large vécu... *BREAK* Y a les Bee Gees qui chantent quand on marche dans la rue *BREAK* Tout c'qui compte, c'est la... *BREAK*  *BREAK* [Refrain] *BREAK* Musique ! *BREAK* Bouffée d'oxygène *BREAK* Quand le ciel s'assombrit... *BREAK* Chaque jour on vit sur ses ailes elle s'appelle...
 *BREAK* Surgi tout droit des murs de béton *BREAK* Le rimeur à gage de Marseille comme d'habitude donne le ton *BREAK* Sans répit sans aucun délit le posse est au complet *BREAK* Le Soul Swing et Uptown m'ont l'air bien armés *BREAK* Ce qui fait déchanter les médisants qui ont pu penser *BREAK* Rapidement que le rap du sud était à oublier *BREAK* Non ! Pas de conclusion hâtive les chacals récidivent *BREAK* Uha ! Prends-toi ça dans les gencives et file *BREAK* Plus fort, plus gore, hardcore ainsi se qualifie *BREAK* La venue du posse le plus obscurci *BREAK* Il n'était pas mort encore moins endormi *BREAK* Il attendait tout simplement son heure dans la pénombre tapi *BREAK* Il a ruminé ruminé ruminé son avènement *BREAK* Puis a calculé calculé comment ne pas rester devant *BREAK* Mais déjà les ondes frémissent et se cachent où elles peuvent *BREAK* Trop tard elle arrive elle arrive je lâche la meute *BREAK*  *BREAK* [Refrain] *BREAK*  *BREAK* [Couplet 2 – Akhenaton] *BREAK* Énormément de jeunes de nos jours se la jouent soft *BREAK* Cheveux gras et se la pètent négligents dans un loft *BREAK* Pour eux Chill est un Alien *BREAK* Mais le cynisme est ma gemme, Damn appelle-moi ta-yen *BREAK* Je triple la magnitude du boom qu'a fait le rap *BREAK* Introduisant de nouveaux ingrédients qui frappent, appelant claps et snaps *BREAK* La nouvelle jungle, génère la mentalité *BREAK* De la meute ; pure insanité *BREAK* Que désirer nous trahir ou nous tester *BREAK* Car ce soir les sales métèques sont presque tous lestés *BREAK* Je condense les folies, les envies *BREAK* Des gens qui comme moi en ont marre *BREAK* De jouer les Jésus Christ *BREAK* Ma philosophie est si complexe que les naïfs s'y nèguent *BREAK* Est-on collègue ? Non ! Alors lâche-moi le zguègue *BREAK* Choisis ton camp car il n'y a plus d'espace pour le Neutre *BREAK* D'un geste anodin, c'est la terreur je lâche la meute *BREAK*  *BREAK* [Refrain] *BREAK*  *BREAK* [Couplet 3 – Shurik’n] *BREAK* Je lâche la meute gare aux gros dealers qui se meuvent *BREAK* Dans les cités qui se plaignent que depuis dix ans rien n'a changé *BREAK* Alors quoi vous roulez en B.M. et c'est la fête *BREAK* Payez cash pas de trace ni crédit ni dette *BREAK* Le réservoir est grand mais toujours rempli *BREAK* Par le sang des enfants à qui vous vendez ce produit pourri *BREAK* Je vous dis ma façon de penser dans un style qui m'est propre *BREAK* Boom !! Trop tard pour esquiver *BREAK* C'est mon choix mon droit ça ne te plaît pas tant pis pour toi *BREAK* Si ailleurs tu fais la loi sur scène je suis roi *BREAK* Froid comme les plaques ornant les cimetières *BREAK* Je ferai la sourde oreille quand viendra ton requiem *BREAK* Tu multiplies les crimes mais un jour il te faut payer *BREAK* La vie ne tient qu'à un fil trop mince pour résister *BREAK* Car ceux qui vivent par la mort un jour l’abreuvent *BREAK* Dommage Éliane hélas je lâche la meute *BREAK*  *BREAK* [Couplet 4 – Akhenaton] *BREAK* Les clubs de bridge ont les glandes, ont subi le pire des outrages *BREAK* Ce soir la meute a attaqué, et ce fut un carnage *BREAK* Je suis fier d'annoncer que les loups deviennent biches *BREAK* Quand les têtes de chiens lancent des raids à partir de leurs niches *BREAK* Ce que tu as pu voir jusqu'ici est révolu, bon ! *BREAK* Nous aboyons, oui, mais la caravane ne passe plus *BREAK* Le terrain est glissant périlleux car nous sommes *BREAK* Les meilleurs ennemis de l'homme *BREAK* Sonne l'alarme, sonne l'alarme, sonne, quand je suis *BREAK* Cool avec un cool avec un cool avec un magnum *BREAK* De rimes j'introduis le Soul Swing *BREAK* Uptown *BREAK* Si la crapulerie a une ballade *BREAK* C'est bien la mienne que voici, fils, je roule avec le Shit Squad *BREAK* La secte n°7 *BREAK* Le bafalostep de Marseille, et le clebs qui n'en fait qu'à sa tête *BREAK* Des quartiers fanatiques de Belsunce et de Félix Pyat *BREAK* Le gros de la troupe accourt avec hâte *BREAK* Paix à nos ramifications à Paris, N.Y, peuple *BREAK* Pas de rémission, c'est sans appel *BREAK* Je lâche la meute *BREAK*  *BREAK* [Refrain]
 *BREAK* Rangé du côté obscur *BREAK* J'ai pas le temps d'jouer *BREAK* Enjoué, le Smith & Wesson pour te trouer *BREAK*  *BREAK* [Couplet 1 - Akhenaton] *BREAK* J'entends du rap dans les tours *BREAK* Tous les jours je cours, je deviens sourd *BREAK* Les bas-fonds vivent quand le rythme est lourd *BREAK* Aurais-je à ce point exagéré *BREAK* Que j'entendrais plus de mots *BREAK* Que Charles, les RG et la DST réunis *BREAK* Mais ceci par la loi n'est pas puni *BREAK* Prémuni de poèmes écrits pour les plus démunis *BREAK* Si vivre pour et par le rap en vaut la chandelle *BREAK* American Express, je suis toujours parti sans elle *BREAK* Un coup dans l'aile, j'avais juste un Bridoux gardé en rondelles *BREAK* Désolé, je rappelle, je suis pas du clan Campbell *BREAK*  *BREAK* Donc je puise dans la réalité, les faits *BREAK* Dans ce domaine en tout cas je n'ai jamais été défait *BREAK* Un pur lyriciste militant, j'écris à vue *BREAK* Malgré cela, autant je suis cool *BREAK* Autant de gens me disent dangereux, Quoi? *BREAK* Qu'on-t'ils à craindre d'un pauvre bougre maigre comme moi *BREAK* Mais que se passe-t'il enfin qui les agite *BREAK* On fouille dans leurs comptes et personne ne les acquitte *BREAK* Je sens que de plus en plus, on va se délécter *BREAK* De vérité, de réalité, écoutez : *BREAK*  *BREAK* [Refrain] *BREAK* Les choses que beaucoup de gens croient *BREAK* Ne reflètent pas la vérité *BREAK* Il faut s'appliquer selon moi à *BREAK* La réalité *BREAK*  *BREAK* Ho-yo, la réalité dépasse la fiction *BREAK* N'oublie jamais que *BREAK* Ho-yo, la réalité dépasse la fiction *BREAK* N'oublie jamais que *BREAK* La réalité *BREAK*  *BREAK* [Couplet 2] *BREAK* Faire quelques pas, que tout doux *BREAK* Je pourrais vous jouer le clown *BREAK* Pour empocher des sous, mais où *BREAK* Cela me mène-t'il avec ma conscience, fils *BREAK* Vivre attendant que les remords grandissent, je glisse *BREAK* Une phrase à mes mots, et tout est rétabli *BREAK* Je sers les [???] dans l'établi, et si *BREAK* Robert et Marcel nous envoient plus de fric *BREAK* C'est que Germaine crève son sac, c'est véridique *BREAK* Ont-ils essayé de nous connaître avant la haine *BREAK* Nous ont-t'ils croisé avant de voter FN *BREAK* Aucuns ennuis, de contrôles d’identité *BREAK* Mais nous, deux fois par jour, dont on le supportait *BREAK* Ok! Il y a des mauvais garçons dans le quartier *BREAK* Et avant les Arabes déjà, il y en avait *BREAK* Mais toute cette tension, de nouveaux voleurs éveille *BREAK* "Allez donne-moi ton sac, la vieille !" *BREAK*  *BREAK* En bref, ils créent les loups qui vont les attaquer *BREAK* En votant un côté qui donne le droit de matraquer *BREAK* S'ils savaient comment c'est dur de réussir *BREAK* Les barrières, et passer à travers les mailles du filet *BREAK* Si sex and sun *BREAK* Baston générale ici, pour dix sacs de shit *BREAK* Ils voient du luxe et des rêves et vivent dans la vanité *BREAK* Je vois des tox' et des flics, c'est la réalité *BREAK*  *BREAK* [Refrain] *BREAK*  *BREAK* [Couplet 3] *BREAK* Ils décident pour nous, discutent de nos problèmes *BREAK* Mais c'est le jouet des pères qui ont beaucoup de peine *BREAK* Mais je trouve à cette quête un côté malsain *BREAK* Comme a dit Bob Marley, quoi qu'ils disent leur ventre est plein *BREAK* De bouffe, un samedi soir le nez plein de schnouff *BREAK* Ils refont notre monde du haut d'un pouf *BREAK* Les riches aiment la coke, car cette drogue les aide *BREAK* À se prendre pour Dieu *BREAK* Même s'ils sont assis sur un tas de merde *BREAK* Ils voguent dans le vagues des théories, peut-on dire aux enfants *BREAK* Qu'ils ont des solutions si l'espoir nous faire vivre *BREAK* Inutile de mentir, a contrario le désespoir fait mourir *BREAK* Réel, imaginaire, bordel danse *BREAK* La 25ème image crée des tueurs en puissance *BREAK* Les promesses dorment dans la virtualité *BREAK* Ibrahim assassinéça c'est la réalité
(1er couplet : East) *BREAK* S'ouvre la porte du deuxième couplet *BREAK* Dimension Côté Obscur *BREAK* Force de l'énergie pure *BREAK* Les voix de la souffrance dure *BREAK* Ma rime originale marque déposée assure mon revenu *BREAK* Je mets mon cerveau à l'épreuve et nous sommes entendus *BREAK* De par le globe, ma verbalistique flotte dans l'air du temps *BREAK* Réfléchir avant d'écrire, le principal élément *BREAK* Ça paraît si simple à faire, pourtant mon écoute est claire *BREAK* A part quelques groupes qui carburent nous kiffons peu les concerts *BREAK* L'Enfer, mais quelle est leur motivation première ? *BREAK* Prennent-ils plaisir à tchatcher ? Est-ce la crème, les billets verts ? *BREAK* J'opère dans les bas fonds, cerbère du dernier bastion *BREAK* Mes vers pour le Double H expression de l'opinion *BREAK* Une partie de la jeunesse n'a presque rien ou si peu *BREAK* Quand tu retournes tes poches la poussière te pique les yeux *BREAK* C'est clair, l'avenir ne nous réserve rien de bon *BREAK* Vivant au jour le jour pour nous c'est la même de toute façon *BREAK* Nous sommes toujours à l'heure, vivement le troisième round *BREAK* East et Cut tout droit de l'original underground *BREAK*  *BREAK* (Refrain) *BREAK* L'Enfer, mais quelle est leur motivation première ? *BREAK* L'Enfer est sur Terre, le blanc le noir ne sont pas roses *BREAK* Faut-il encore que le sang coule ? *BREAK* Ces mots reviennent sans cesse, mais le problème demeure *BREAK*  *BREAK* (2ème couplet : Akhenaton) *BREAK* Les coups partent de tous bords, mais quand c'est que des claques, ça va *BREAK* Ce soir baston à mains nues pas de gros dégâts *BREAK* Les gars sortent pour jouer des kentos *BREAK* Dégainent des pointeaux, frappent, lacèrent, ciao crève, à bientôt *BREAK* Personne ne bouge, il demeurent sur leurs gardes *BREAK* Tendus, au cas où un gadjo les regarde de travers *BREAK* C'est l'enfer, cycle amer, trop pervers *BREAK* 2,3 coups par derrière, embrouille ? Pow ! Revolver *BREAK* Pour le plaisir, mais le plaisir, n'est-il pas de rire ? *BREAK* Un bon délire avec son équipe, ça fait frémir *BREAK* J'ai besoin d'un break, cette fois-ci c'est clair *BREAK* Quel est leur but, leur guerre, leur motivation première ? *BREAK* D'ailleurs, mes mœurs s'assortent pas avec ces railleurs *BREAK* Assis en tailleur, je suis bien meilleur, un vrai seigneur *BREAK* La violence m'exaspère, ces types me sont antipathiques *BREAK* Surtout quand elle est gratuite *BREAK* Un homme est un homme avec ou sans le chrome *BREAK* Se battre pour la réputation, c'est se battre contre des fantômes *BREAK* Sûr. Frère, tes agissements sont terre-à-terre *BREAK* Faire parler les poings à chaque sortie, sans arrêt, c'est *BREAK*  *BREAK* (Refrain) *BREAK* L'Enfer, mais quelle est leur motivation première ? *BREAK* L'Enfer est sur Terre, le blanc le noir ne sont pas roses *BREAK* Faut-il encore que le sang coule ? *BREAK* Ces mots reviennent sans cesse, mais le problème demeure *BREAK*  *BREAK* (3ème couplet : Fabe) *BREAK* Bef' dans la place alias l'Impertinent *BREAK* Marche ou crève y'a pas de trêve et ça continue *BREAK* Le film de la vie, là où l'acteur est un inconnu *BREAK* Un type qui passe efface hélas un gosse innocent *BREAK* Une justice qui glisse comme le vice sur nos enfants *BREAK* Plantant d'autres enfants prenant du bon temps *BREAK* Distancé, jamais à temps, d'ici gars j'entends *BREAK* Des sirènes, pas celles de la Seine *BREAK* La police, coulisses du vice, délices du délit *BREAK* Du préjudice, des gars qui courent, des complices, fils *BREAK* Des cons tout court, qui font tout pour qu'ici la vie ici ce soit *BREAK* Chacun pour soi et Dieu pour tous *BREAK* Rac-Chi, pourquoi tu tousses ? C'est toi qui pousse *BREAK* Mes frères à bout j'arrive à la rescousse *BREAK* Pousse-toi de là, je fais mes affaires c'est dur à faire *BREAK* Par là et je parle à mes scars-la *BREAK* Ce que j'ai à faire sur la Terre frère c'est la guerre aux stéréotypes *BREAK* Je flaire pas, mon but c'est de pas rester terre-par *BREAK* Je fais ce que je peux avec ce que j'ai *BREAK* Donc de plus en plus je rate des bus *BREAK* Mais pas ma vie quand je donne mon avis *BREAK* Je modère mes envies et j'avise toujours en quête de réalité *BREAK* Comme E.A.S.T l'a été. Paix ! *BREAK*  *BREAK* (Refrain) *BREAK* L'Enfer, mais quelle est leur motivation première ? *BREAK* L'Enfer est sur Terre, le blanc le noir ne sont pas roses *BREAK* Faut-il encore que le sang coule ? *BREAK* Ces mots reviennent sans cesse, mais le problème demeure *BREAK*  *BREAK* (4ème couplet : Shurik'n) *BREAK* Il est déjà à la fenêtre quand le réveil sonne *BREAK* Il regarde la cour mais il n'y a encore personne *BREAK* Pourtant dans quelques heures, le silence ne règnera plus *BREAK* Beaucoup de jeunes y viendront passer une journée de plus *BREAK* Vaincus par l'oisiveté ou las d'aller pointer *BREAK* Pour rien certains iront dealer *BREAK* Devant les plus jeunes émerveillés par tant de billets *BREAK* Le genre de gâteaux qu'ils se languissent de goûter *BREAK* Déjà résignés à suivre le chemin qui leur est tracé *BREAK* Ils ne pensent même pas à lutter *BREAK* La vie est un film où tout le monde a un rôle à jouer *BREAK* Le problème, c'est qu'il y a trop de séries B *BREAK* Trop de seconds rôles croulant sous le poids du premier *BREAK* Trop de modèles sur lequel ils vont calquer *BREAK* De leur démarche jusqu'à leur manière d'être *BREAK* Ainsi ils ont l'impression d'ouvrir une fenêtre *BREAK* Quelle est leur motivation première, je n'en sais rien *BREAK* Peut-être aiment-ils vivre le purgatoire au quotidien *BREAK* D'un regard extérieur, il se dit, c'est pas de leur faute *BREAK* Cette fois il a raison : l'Enfer, c'est les autres
