[Refrain] *BREAK* Ça s'passe comme ça chez le mac *BREAK* Ça s'passe comme ça chez le mac *BREAK*  *BREAK* [Couplet 1 - Akhenaton] *BREAK* Les rues sales du centre ville de Mars est mon turf *BREAK* Mac aussi puissant que ce putain d'argent sur le surf *BREAK* J'ai tout pris en main et les condés se tâtent *BREAK* Pas de racket, je suis libre des vapeurs d'eau écarlate *BREAK* Et des tubes de colle, à coups de latte *BREAK* Les consonnes, les voyelles, sont toutes à quatre pattes *BREAK* Proxénète linguistique, pur style *BREAK* Manteau en fourrure *BREAK* Je ne sais pas où cela me mène *BREAK* Mais même ceux qui m'aiment me décrivent comme étant un schizophrène *BREAK* J'ai mis les mots au tapin pour la sensation *BREAK* Au trottoir les syllabesprostitué la diction *BREAK* Les lettres travaillent pour moi *BREAK* Le dico est mon territoire, un pays dont je veux être le roi *BREAK* J'ai traité des phrases comme de vraies dames *BREAK* Tiré les plus belles pour les mettre en vitrine comme à Amsterdam *BREAK* Si tu veux la qualité normal, tu payes et cash *BREAK* Ça arrache, à consommer avec un tchoc de hasch *BREAK* J'ai des potes dans la profession, c'est pas la mode *BREAK* Mais pourquoi crois-tu que DRS s'appelle Mr Claude ? *BREAK* Petit parade avec tes illusions de Benz *BREAK* T'es une merde sur le marché parce que tes phrases sont renze *BREAK* C'est dommage, t'es guetté par le chômage *BREAK* Mon organisation est trop en place et bien trop sauvage *BREAK* Ma famille vient de ce quartier, qui faisait peur à Hitler *BREAK* Où la French est née pour niquer la terre entière *BREAK* Je m'en souviens encore mais pourtant je devais être petit *BREAK* Scarface n'est pas un rêve, il a existé ici *BREAK* L'Italiano prend la relève vingt ans après *BREAK* C'est tout un autre monde, c'est tout un autre marché *BREAK* Je suis discret, distant, dispo, prêt à disparaître *BREAK* Mon discours éternel, seul un rêve peut renaître *BREAK* Un jour, sous une forme nouvelle *BREAK* D'un novice, 26 lettres 100.000 mots à son service *BREAK* N'est pas mac qui veut *BREAK* Mais je croise des concurrents sérieux *BREAK* Alors je redouble de travail et serre le jeu *BREAK* Si tu veux la bombe, tu raques Ronald *BREAK* Ça s'passe comme ça chez le mac *BREAK*  *BREAK* [Refrain] *BREAK* Ça s'passe comme ça chez le mac *BREAK* Ça s'passe comme ça chez le mac *BREAK*  *BREAK* [Couplet 2 - Shurik'n] *BREAK* Le petit noir à tête rasée réapparaît *BREAK* Moi non plus j'ai pas changé toujours prêt à dégainer *BREAK* Mon micro branché sur une table envoie le morceau *BREAK* Vérifie la console qu'elle fasse bien son boulot *BREAK* Ouais, c'est comme ça avec le micet les samplers *BREAK* Au doigt et à l’œil, alors qui c'est l'empereur ? *BREAK* La MPC travaille pour moi très dur *BREAK* Et au moindre bug, je la colle au mur, c'est sûr *BREAK* La dernière mélodie que j'ai recrutée *BREAK* S'est prise deux gifles quand elle a refusé de se faire truncater *BREAK* En fait je suis le seul boss du matos *BREAK* Tous les câbles qui font les macs tombent vite sur un os *BREAK* Tout le monde y a droit qu'est-ce que tu crois ? *BREAK* Les lettres, elles aussi, taffent pour moi *BREAK* 26 lettres chacun sa chacune *BREAK* Deux claques sur les fesses et vite par ici la thune *BREAK* C'est comme ça que dans mon job que ça se passe *BREAK* J'ai beaucoup d'employés et je ne paie rien à l'Urssaf *BREAK* Et je n'ai pas eu depuis longtemps à sévir *BREAK* Elles ont réalisé que leur plaisir est de me servir *BREAK* Si elles le font bien, je les place dans des phrases *BREAK* Promotion sociale pour elles, pour moi plus de liasses *BREAK* Mais le fin du fin, c'est le couplet quand elles y sont arrivées *BREAK* C'est qu'elles sont classées top dans mon carnet *BREAK* Celles qui attendent de moi un geste en retour *BREAK* Ont beaucoup d'espoir, d'ailleurs elles courent toujours *BREAK* Je table sur la qualité, pas la quantité *BREAK* D'un service organisé créé pour vous faire planer *BREAK* On y trouve des plates, des croisées, des embrassées *BREAK* Choisissez, chacune d'elles a sa spécialité *BREAK* J'ai dû transpirer dur pour y arriver *BREAK* Mais ça sert d'avoir de la famille bien placée dans le métier *BREAK* Le prox *BREAK* J'aurais dû faire du foot, j'ai toujours eu le sens des putes *BREAK* Surtout, ne viens pas taper à ma porte sans des Deutschmark *BREAK* Ça se passe comme ça chez le mac *BREAK*  *BREAK* [Refrain] *BREAK* Ça s'passe comme ça chez le mac *BREAK* Ça s'passe comme ça chez le mac
 *BREAK* Tu as de la chance, je suis le dernier à pouvoir te lire le vieux langage, à faire parler pour toi tous ces oiseaux muets qui t’étonnent, les lisant sur les murailles comme dans un livre’’ *BREAK*  *BREAK* [Freeman] *BREAK* J't'offre pas mon r'gard, t'es ma meilleure garantie *BREAK* C'est pas que j't'aime pas, dehors trop m'aime pas *BREAK* J't'ai pris bras droit, on m'a dit bats-toi *BREAK* C'est c'que j'ai fait dans c'foutoir et c'est pas ma voie *BREAK* J'ai vu qu'y'avait trop d'tox, trop d'putes, trop d'traîtres *BREAK* Trop d'mal, trop d'fables, trop d'sales, trop foire *BREAK* Trop d'poires, trop d'vols, trop d'jeunes, trop d'peine *BREAK* Trop d'flingues, on t'rend hommage *BREAK*  *BREAK* [Akhenaton] *BREAK* J'ai approché de vous comme un spray, une teinte chrome *BREAK* Mon tort, j'ai tourné l'dos, ma vie j'l'ai vue bonne *BREAK* Horloge de mes heures dispersées, parfois d'face *BREAK* Forcé par la canine, j'vous ai embrassé *BREAK* Gratter par la lame d'un opinel ignoble *BREAK* Dans l'rôle, de la schnouf, étalé dans l'aluminium *BREAK* Striée en sillons sur la table d'un guillaume *BREAK* A vos pieds, cimetière de mes piles au lithium *BREAK*  *BREAK* [Shurik'n] *BREAK* Pourquoi, j'ai forcé tant d’fois, à supporter ma rage, observateur *BREAK* Sage enduit de plâtre qui insulté et outrage violemment convoite *BREAK* Témoin des discussions tardives et secrètes d'échanges *BREAK* Bref d'coup d'œil furtif, de têtes qui s'tournent toutes en même temps *BREAK* Un ange passe laisse une trace plus belle qu'un mégot qu'on écrase *BREAK* Ou qu'une face qu'on plaque sur la tienne la haine *BREAK* Ça te gêne que la nuit revienne *BREAK* Qu'à nouveau sur toi l'amour se déchaîne *BREAK*  *BREAK* [Refrain] (X2) *BREAK* Action, frisson, mur, tesson *BREAK* Friction, gros son, mur, pulsion *BREAK* Tension, vision, placide mur *BREAK* Vestige d'illusions *BREAK*  *BREAK* [Freeman] *BREAK* Ses 2 mains, son front appuyé sur toi, yeux clos *BREAK* A g'noux l'enfer l'tient par son laxisme *BREAK* Parfait, dégain l'est, ici les cœurs sont bien laids *BREAK* Regardez-les, qu'il voit crever doucement *BREAK* Qui bouge, qui laisse sa trace avec un geste bon *BREAK* Qui s'mouille, qui brise sa cloison l'poison *BREAK* Ils passent d'vant toi, sans voir qui y'a autour *BREAK* Enfin ! Ils évitent, donc, j'en parle à travers Shure *BREAK*  *BREAK* [Akhenaton] *BREAK* Havres d'âmes à la dérive, auréoles glauques *BREAK* Murs mastoc, s'imposent comme seigneurs de ces blocs *BREAK* Tatoués ou gravés jusqu'à la moelle opaque voile *BREAK* Scellant l'intimité de nos proches, comme une vivante toile *BREAK* Et mille chocs, façonnant vos visages *BREAK* Empêche mes yeux de parcourir le paysage *BREAK* Combien d'fois ai-je écrit mon idéal sur c't'héritage ? *BREAK* Stériles larmes, art sacré, traits véritables *BREAK*  *BREAK* [Freeman] *BREAK* J't'ai toujours eu, à côté d'moi, ici l'haïtiste *BREAK* Impossible d'me lever ça, c'que l'on piste *BREAK* L'vicelard, fils, vise l'artiste, peace des abysses *BREAK* J'ai gardé un coin d'toi, dans mon cœur *BREAK* C'est lui qui t'parle, j'ai qu'ça et ça s'ressent sale *BREAK* Comment veux-tu que j'perde ça ? J'ai tissé ma toile *BREAK* A travers ton r'gard, fuck les ronflards *BREAK* C'est avec ma plume, que j'vois, que j't'ai quitté trop tard *BREAK*  *BREAK* [Refrain] (X2) *BREAK* Action, frisson, mur, tesson *BREAK* Friction, gros son, mur, pulsion *BREAK* Tension, vision, placide mur *BREAK* Vestige d'illusions *BREAK*  *BREAK* [Shurik'n] *BREAK* Combien de gars t'as vu passer, hagard cassé sur tes flans *BREAK* S'appuyer tirant l'chariot rouillé pliant sous leurs vies empilées *BREAK* De cars bondés de monde, mais chacun dans le sien, de bandes de mômes *BREAK* Dont l’sourire éclaire la journée du plus dur des hommes *BREAK* Comme ceux qui te donnent le tournis, viendra ? viendra pas ? *BREAK* Heureusement ses potes le voient pas *BREAK* Et toi tu parles pas, ton cœur bat au rythme des gens *BREAK* De leurs pas de leurs vies, de leurs choix *BREAK* Ton rictus, ironique cette nuit personne ne le verra *BREAK*  *BREAK* [Akhenaton] *BREAK* Dites moi combien d'amants se sont aimés, cachés dans vos alcôves *BREAK* Doucement, violemment, riches ou pauvres *BREAK* Clique fauve, nuit folles, miradors de la faune *BREAK* Profondes racines, de ces lignes, qui coupent nos paumes *BREAK* Combien d'affiches vous ont salis *BREAK* Comme si votre âme était à vendre, ont-ils une once de rectitude ? *BREAK* Droits, murs, témoins de ma sombre solitude *BREAK* Savent bien, qu'on peut devenir con par habitude *BREAK* Combien de pas ont caressé l'bitume, exactitude *BREAK* Ils savent qui à Reïf et qui tue *BREAK* Live in situ, gloire et lassitude, avis brut *BREAK* Pourquoi la rue est elle ainsi pute ? *BREAK*  *BREAK* [Shurik'n] *BREAK* T'aurais pu être autre chose j'sais pas, un abri bus *BREAK* T'aurais un banc, au moins tu lècherais pas la semelle de tous les gus *BREAK* A qui tu coupes les ailes qu'pour ça que ça picole et qu'l'ivresse *BREAK* Les ramène vers toi souvent de façon moins drôle *BREAK* Processus maudit rituel planétaire rude adversaire marquage sévère *BREAK* Pour toi, ces quelques vers entre pisse et bris de verre, salutaire *BREAK* L'amour s'grave au cutter l'espoir entame ta pierre *BREAK* Comme les balles des faits divers, et les armes d'hiver *BREAK*  *BREAK* [Refrain] (X2) *BREAK* Action, frisson, mur, tesson *BREAK* Friction, gros son, mur, pulsion *BREAK* Tension, vision, placide mur *BREAK* Vestige d'illusions *BREAK*  *BREAK* [Samples] *BREAK* ‘’A travers les rues de la ville’’ *BREAK* ‘’Ces vérités sans oxygène’’ *BREAK* ‘’S’échapper des rues sales et des flaques d’urine’’ *BREAK* ‘’On est fier de rien’’ *BREAK* ‘’Tant d'secrets, d’énigmes à à percer’’ *BREAK* ‘’J’ramène le rap à la base’’ *BREAK* ‘’Iota, Alpha, Mu’’
Intro *BREAK* Ils sont fiers d’être les enfants de Marseille *BREAK* IAM est dans la place ! *BREAK* Ils sont fiers de le crier sur scène *BREAK* Je partirai...comme un Samouraï! Yes , merci! *BREAK* ''En ces temps très agités, (scratch) que cette victoire soit une parcelle ajoutée aux victoires éternelles de la musique contre les défaites quotidiennes de l'humanité'' *BREAK* La consécration pour IAM.. *BREAK* IAM, IAM, IAM... *BREAK* Le groupe de l'année : IAM ! *BREAK*  *BREAK* [Couplet 1 - Akhenaton] *BREAK* Un dernier coup d’éclat *BREAK*  *BREAK* Pour une fois dans ma vie, je me sens, comment dire ? Libre *BREAK* Affranchi d’obligations stupides, mine *BREAK* Entre le pouce et l’index *BREAK* Et si tu veux vraiment me cerner tends l’oreille et écoute un peu les textes *BREAK* Clairs, comme une nuit de pleine lune *BREAK* Pour les dérouter parfois je fais rentrer la brume *BREAK* Je suis complexe *BREAK* Lance missile avec une rampe tanquée dans mes lacunes *BREAK* Parade pour la poésie qui nous a déposés là *BREAK* Demain c’est loin et toute la foule rappe a cappella *BREAK* Pour mes jours à NYC *BREAK* Hors catégorie IAM, on a violé la norme *BREAK* C’est pour Richard, ouais, pour mon père, ouais *BREAK* Pour mon amour, tu m’as levé j’étais à terre, ouais *BREAK* Et cette cage qui enserre mes colères *BREAK* Cahier d’un môme détruit par le système scolaire *BREAK* Équation qui régit tout le système solaire *BREAK* Energie, trop serré les dents, j’ai perdu mes molaires *BREAK* Non, le coran, la bible, tous annoncent l’abîme *BREAK* J’ai vu les cieux s’ouvrir au pied des pyramides *BREAK* Pour mes frères, ma main, la phalange *BREAK* Impérial asiatiqueEcole du mic *BREAK* Le futur est flou, quoiqu’il arrive, bosse *BREAK* Le son est resté brut, allez, adios amigos *BREAK*  *BREAK* [Refrain] *BREAK* On dit que les rideaux se ferment, voilà *BREAK* On a des bombes dans l’arsenal *BREAK* Et bien trop peu de mèches, mec *BREAK* C’est que de l’amour, mec *BREAK* On se fout de la fraiche, mec *BREAK* Je parade pour un dernier coup d’éclat *BREAK*  *BREAK* [Couplet 2 - Shurik’n] *BREAK* Pour cet art brut, fils des bas-fonds, poésie de ces temps *BREAK* Résistants au vent violent et martelant mes tempes *BREAK* Et ce tas de phrases torturées, ces feuilles raturées *BREAK* Ces basses saturées, ces caisses claires m’ont capturé *BREAK* Par ses bras rassuré, j’ai abattu des murs *BREAK* Je me suis aventuré là où la foi ne subit pas d’usure *BREAK* Pour cette musique qui de ma rage se fit l’écho *BREAK* C’est peut-être grâce à elle si aujourd’hui j’ai toujours pas rejoint Momo *BREAK* Pour mes compagnons de voyage, mes frères d’arme *BREAK* Le sang-froid et la maîtrise, les seuls à rester calmes dans ce vacarme *BREAK* La route fut longue et le terrain souvent accidenté *BREAK* Mais, cette vie a fait de nous une troupe d’élite surentrainée *BREAK* Embarqués malgré nous dans une course au delà de nos rêves *BREAK* Humbles et sereins regarde nous, droits, le sourire aux lèvres *BREAK* Un groupe de gars à leurs baloches, bien accrochés *BREAK* Soldat de Mars *BREAK* Pour ma chair et mon sang et toute cette force qu’il m’a donnée *BREAK* J’espère lui en donner autant vu tout ce futur à affronter *BREAK* Pour ma famille je ne pouvais pas espérer mieux *BREAK* Je suis ce qu'ils ont fait de moi, et ça, ça se voit au plus profond de mes yeux *BREAK* Pour celle qui m’a donné de l’air quand j’étais en apnée *BREAK* Qui m’a rappelé que de belles choses peuvent encore m’arriver *BREAK* Au nom de tous ces gens, des coups d’éclat, ouais j’en ai fait *BREAK* Gardiens des miens *BREAK*  *BREAK* [Refrain] *BREAK* On dit que les rideaux se ferment, voilà *BREAK* On a des bombes dans l’arsenal *BREAK* Et bien trop peu de mèches, mec *BREAK* C’est que de l’amour, mec *BREAK* On se fout de la fraiche, mec *BREAK* Je parade pour un dernier coup d’éclat
 *BREAK* L’alphabet m’a dit "use-moi dans mes combinaisons les plus folles" ! *BREAK* Je l'ai fait briller dans les bouges et les nuits les plus fauves *BREAK* Demande pas c’qu’y a au prochain épisode *BREAK* Je brode ma prose sur un corps recouvert d’ecchymoses *BREAK* Loin des récompenses, titres honorifiques *BREAK* On doit montrer qu’on est honnêtes aux flics trois fois par jour *BREAK* Les grands du pays s’accrochent comme les morbacs *BREAK* Aux p’tits boutons rouges sur leurs colbacks *BREAK* Pourquoi on les décore ? *BREAK* Avoir chassé des sauvages et mis leurs forêts dans des meubles en kit ? *BREAK* Laisse-moi rire, au quotidien des anges *BREAK* Donnent leur temps pour les autres sans euros en échange *BREAK* Et c’est à eux que devraient revenir les honneurs *BREAK* Ceux qui sont sur le terrain, témoins d’ces horreurs *BREAK* Non pas à nous, et encore moins aux huiles *BREAK* A ces têtes gentilles qui violent et pillent nos villes *BREAK* Qui sont épinglées en grande pompe dans les pavillons du Président *BREAK* Et qui ne méritent qu’un coup d’pompe, c’est évident *BREAK* On fait d’la création du hors-protocole *BREAK* Ils ont le cœur sur la main, et leur main est au coffre *BREAK*  *BREAK* [Refrain] *BREAK* On veut pas d'médailles *BREAK* Parce qu’on est pas parfaits et que nos crasses l'émaillent *BREAK* On chante nos victoires et on chante nos failles *BREAK* On chante l’amour de là où on est nés, qu’ils essaient de nous péter le bail *BREAK* On veut pas d’médailles *BREAK* On est des panthères lâchées dans l’bétail *BREAK* Dis-moi à quoi ça sert puisqu’un jour tu die ? *BREAK* Mieux vaut passer le temps à essayer de sauter de ce train qui déraille *BREAK* On veut pas d’médailles, non ! On veut pas d’médailles (X2) *BREAK*  *BREAK* [Couplet 2- Shurik'n] *BREAK* Qu’ai-je fait de spécial ? Quoi de plus qu’un autre ? *BREAK* Simple troubadour, je place des mots sur quelques notes *BREAK* J’ai pas l’courage de ceux qui vouent leur vie à une cause *BREAK* Et le monde déconne toujours, ma prose a pas changé grand chose *BREAK* Je les regarde parader fièrement, l’égo sur la poitrine *BREAK* Pendant qu’Armand s’éveille tremblant dans sa tente de camping *BREAK* C’est la qu’il vit maintenant depuis qu’ils ont fermé son usine *BREAK* Et comme c’est eux qui font les lois, aucune médaille aux victimes *BREAK* Je narre les miens ainsi qu'les vôtres, pas d’éloge please ! *BREAK* Je suis qu’un badaud, je vois qu'les bandeaux, parfois les murs je brise *BREAK* J’ai bien moins de mérite qu’une femme en blouse sur le pallier *BREAK* Et plus qu’un politique, moi j’parle des gens et j’les fais rêver *BREAK* Ça s’félicite, ça s’congratule, et on n'sait même pas pourquoi ! *BREAK* Surement pour ces familles essorées et puis laissées aux abois *BREAK* Au moindre cocktail ils débarquent avec leurs trophées *BREAK* Au buffet tous remplis d’un héroïsme surfait *BREAK* On dit qu’la valeur des gens se mesure souvent à leurs actes *BREAK* J’en ai vu des héros, et dans leurs poches y’avait aucun as *BREAK* Que de l’amour et chaque jour une dose de courage *BREAK* Aucune médaille pour nous, eux seuls reçoivent les hommages *BREAK*  *BREAK* [Refrain]
 *BREAK* Quelle ironie ! *BREAK*  *BREAK* Après la fête… *BREAK* Il n’y a plus un bruit… *BREAK* Les chaises se vident… *BREAK* La réalité revient, ouais… *BREAK*  *BREAK* [Couplet 1 - Akhenaton] *BREAK* Après la fête on se fait la bise, on tombe dans les bras l’un de l’autre *BREAK* On passe un instant et puis on se dit au revoir *BREAK* 1 mois file, 1 an, ensuite, on s’appelle plus *BREAK* Il faut croire que c’est ainsi doucement on se perd de vue *BREAK* Parfois, assis chez moi, je revois des visages *BREAK* Défiler dans mes rêveries de ceux qui ont quitté ce rivage *BREAK* Par la force des choses ou maladie grave, par souhait *BREAK* Par désir, *BREAK* Pour échapper au glaive ou esquiver la balance *BREAK* En allant, loin des emmerdes qui tombent en avalanche *BREAK* Fatigués de devoir encaisser tes tas de salades *BREAK* Plein de gars veulent te serrer et t’emmener en balade *BREAK* Après le lycée, les chemins s’écartent, on évolue *BREAK* Et sur nos dos le sablier jette son dévolu *BREAK* Torse nu sur les scooters, on se montre à tout le monde *BREAK* Plein été, sentais la vie entrer dans mes poumons *BREAK* On est ces rois dans les châteaux de cartes, les illusions se brisent *BREAK* Et de princes on passe à chiens de la ville *BREAK* Ils sont loin ces samedis au parfum acidulé *BREAK* Mes souvenirs, décidemment si durs à manipuler *BREAK*  *BREAK* [Refrain] (x2) *BREAK* Après la fête tout s’estompe *BREAK* Y a plus un bruit, on tourne la page *BREAK* Les chaises se vident, au revoir tout le monde *BREAK* La réalité revient, on peine à porter la charge *BREAK*  *BREAK* [Couplet 2 - Shurik’n] *BREAK* Dans le miroir les visages se redessinent, les traits se durcissent *BREAK* On trouve que les aiguilles vont bien trop vite *BREAK* Les potes de bringues font place aux collègues de travail *BREAK* Le rien à foutre de tout devient : il faut de la maille et signer le bail *BREAK* La vue se voile, on perd de vue quelques proches *BREAK* L’insouciance est loin et le futur vient de sonner la cloche *BREAK* Le temps, passe d’un coup de pinceau sur les murs *BREAK* Et dans ces rues, berceau de nos enfances, témoins de toutes nos aventures *BREAK* Certaines blessures ont disparu, d’autres sont restées *BREAK* La vie a fait le tri, les plus profondes lui ont résisté *BREAK* Et on pense plus à demain qu’hieren quête du bonheur suprême *BREAK* Chacun se bat pour lui certains l’espèrent du fond de leurs prières *BREAK* Un beau jour il débarque, évident comme l’évidence *BREAK* C’est devenu tellement rare pas question de laisser passer la chance *BREAK* Et, l’instant d’après on s’éveille auprès d’elle *BREAK* 2 secondes plus tard sans le voir venir, on se retrouve debout devant la maternelle *BREAK* Dans une boîte à chaussures on a rangé nos photos *BREAK* Vestige de hauts faits d’armes, l’alcool, les boîtes, les filles, les potos *BREAK* Epoque où le passe-temps favori c’était briller en soirées *BREAK* On faisait la fête, c’est tout, sans même savoir ce qu’il y a avait après, mais… *BREAK*  *BREAK* [Refrain] (x2) *BREAK* Après la fête tout s’estompe *BREAK* Y a plus un bruit, on tourne la page *BREAK* Les chaises se vident, au revoir tout le monde *BREAK* La réalité revient, on peine à porter la charge *BREAK*  *BREAK* [Outro] *BREAK* Après la fête...
 *BREAK*  *BREAK* [Intro : Akhenaton] *BREAK* Hun, remplacez les faits dans leur contexte *BREAK* Et jetez les ténèbres dans la lumière *BREAK* Une fois pour toujours *BREAK* Une fois pour toutes c'est clair je suis sombre (X4) *BREAK*  *BREAK* [Couplet 1 : Akhenaton] *BREAK* J'ai étudié les sciences jusqu'à la faculté *BREAK* Jamais ma foi les découvertes n'a occulté *BREAK* Si j'apprécie les bienfaits pour l'homme qu'elle a générés *BREAK* Pourquoi aurais-je pensé qu'elle me gênerait ? *BREAK* Les débats volent très bas *BREAK* Ces scientifiques voient tout droit pour eux la fantaisie n'existe pas *BREAK* Ils sont obtus, obscurantistes *BREAK* Ils ont désormais les défauts qu'avait l'Eglise jadis *BREAK* Je déteste ce rationalisme inquisiteur *BREAK* Le niveau d'études fait il un être supérieur ? *BREAK* Egocentriques, ils doutent des faits célestes *BREAK* Rient à ta figure quand tu parles d'extraterrestre *BREAK* Mes crédos sont à chasser à leurs yeux *BREAK* Les mystiques comme moi *BREAK* Si ils sont Lumières que Dieu fasse que je sois sombre *BREAK* Une fois pour toutes c'est clair je suis sombre *BREAK*  *BREAK* [Refrain - Akhenaton : x2] *BREAK* Et peu importe leur nombre *BREAK* Une fois pour toutes c'est clair je suis sombre *BREAK* Une fois pour toutes c'est clair je suis sombre *BREAK*  *BREAK* [Scratch] *BREAK* "La force obscure grande et puissante" *BREAK* "And I'm the dark side of the force" *BREAK*  *BREAK* [Couplet 2 : Akhenaton] *BREAK* Ces types trafiquent la génétique *BREAK* Les progrès dit-on évoluent avec un rythme frénétique *BREAK* Au delà des cavitos *BREAK* Ils abusent sur l'expérimentation des fécondations in vitro *BREAK* Je n'oublie pas que cette discipline est un héritage des nazis *BREAK* Les plus fanatiques, créez les, usez les, flinguez les *BREAK* Ne gardant que les purs dans la bouche de Mengele *BREAK* C'est ce qui nous guette ceci est un hommage *BREAK* Quand je vois tous ces essais sur le clonage *BREAK* Que préparent-ils? Quelque chose de grave *BREAK* Comme une génération amorphe, de nouveaux esclaves *BREAK* D'hommes supérieurs, créés dans des fabriques *BREAK* Dont ils seraient les maîtres des critères physiques *BREAK* Découvrir les instruments divins c'est rien *BREAK* Mais jouer avec c'est aller trop loin *BREAK* Et même si c'est nécessaire, je dénonce l'abus *BREAK* De tous ces animaux qui ne crient pas quand ils les tuent *BREAK* Piquez vous tous seuls, et carrez vous vos bombes *BREAK* Au nom d'Averroès c'est clair je suis sombre *BREAK*  *BREAK* [Refrain - Akhenaton : x2] *BREAK* Et peu importe leur nombre *BREAK* Une fois pour toutes c'est clair je suis sombre *BREAK* Une fois pour toutes c'est clair je suis sombre *BREAK*  *BREAK* [Scratch] *BREAK* "La force obscure grande et puissante" *BREAK* "And I'm the dark side of the force" *BREAK*  *BREAK* [Couplet 3 : Akhenaton] *BREAK* Science de l'avenir ou science des tombes *BREAK* Comment les croire quand ils fabriquent des bombes *BREAK* Quand on les célèbre pour leur génie docile *BREAK* Dans le nucléaire, au service du génocide *BREAK* Je suis sceptique quand on me parle de Sida *BREAK* Ce serait un produit de laboratoire que ça ne m'étonnerait pas *BREAK* On appelle ça régulation, moyen d'élimination, de la surpopulation *BREAK* Le surarmement conduit à éviter la guerre *BREAK* Qui peut frapper n'importe qui sur la Terre on laisse faire ! *BREAK* Etrange qui sont les tués, d'abord les homos *BREAK* Les drogués, les pays d'Afrique et les marginaux *BREAK* L'épuration hypocrite de l'instinct s'exacerbe *BREAK* Si c'est le cas nous ne valons pas mieux que les Serbes *BREAK* Le vaccin, ils l'ont sûrement déjà découvert *BREAK* Ouh la commercialisation est une histoire de gros sous *BREAK* Comme ces compagnies pétrolières qui *BREAK* Possèdent les licences pour les futures énergies *BREAK* La Lumière provient elle d'outre-tombe ? *BREAK* Une fois pour toutes c'est clair je suis sombre *BREAK*  *BREAK* [Refrain - Akhenaton : x2] *BREAK* Et peu importe leur nombre *BREAK* Une fois pour toutes c'est clair je suis sombre *BREAK* Une fois pour toutes c'est clair je suis sombre *BREAK*  *BREAK* [Scratch] *BREAK* "La force obscure grande et puissante" *BREAK* "And I'm the dark side of the force"
